query	significant	p_value	term_size	query_size	intersection_size	precision	recall	term_id	source	term_name	effective_domain_size	source_order	enrichment
query_1	TRUE	1.21979741584188e-64	14230	3931	3235	0.822945815314169	0.227336612789881	TF:M00716_1	TF	Factor: ZF5; motif: GSGCGCGR; match class: 1	19917	8791	1.15183498268533
query_1	TRUE	1.21200663159323e-62	9425	3842	2295	0.597345132743363	0.243501326259947	TF:M02089_1	TF	Factor: E2F-3; motif: GGCGGGN; match class: 1	19917	1429	1.26231543860473
query_1	TRUE	1.29518507992161e-62	14041	3876	3155	0.813983488132095	0.224699095506018	TF:M09894_1	TF	Factor: E2F-4; motif: SNGGGCGGGAANN; match class: 1	19917	1443	1.15462638936877
query_1	TRUE	6.93669755183997e-61	10429	3859	2489	0.644985747603006	0.23866142487295	TF:M00986_1	TF	Factor: Churchill; motif: CGGGNN; match class: 1	19917	795	1.23177496739947
query_1	TRUE	3.55487500141137e-60	12431	3929	2901	0.738355815729193	0.23336819242217	TF:M11531_1	TF	Factor: E2F-2; motif: GCGCGCGCGYW; match class: 1	19917	1407	1.18299676469136
query_1	TRUE	4.65034631251906e-60	14592	3879	3242	0.835782418149007	0.222176535087719	TF:M11529_1	TF	Factor: E2F-2; motif: GCGCGCGCNCS; match class: 1	19917	1403	1.14078114187732
query_1	TRUE	3.84296886811843e-57	13271	3931	3043	0.774103281607733	0.229296963303444	TF:M02089	TF	Factor: E2F-3; motif: GGCGGGN	19917	1428	1.16176739204139
query_1	TRUE	3.00710917330534e-56	10303	3849	2442	0.634450506625097	0.237018344171601	TF:M00196	TF	Factor: Sp1; motif: NGGGGGCGGGGYN	19917	7512	1.22647294384665
query_1	TRUE	1.66486413877012e-55	15001	3931	3337	0.848893411345714	0.22245183654423	TF:M10438_1	TF	Factor: ZF5; motif: GGSGCGCGS; match class: 1	19917	8795	1.12708553254934
query_1	TRUE	1.71507563054598e-55	13379	3929	3055	0.777551539832018	0.22834292548023	TF:M11531	TF	Factor: E2F-2; motif: GCGCGCGCGYW	19917	1406	1.15752253672429
query_1	TRUE	2.12424473322324e-54	10217	3866	2428	0.628039317123642	0.237643143779975	TF:M09723	TF	Factor: BTEB1; motif: GGGGGCGGGGCNGSGGGNGS	19917	584	1.22429862769419
query_1	TRUE	3.08518047388668e-54	10294	3866	2442	0.631660631143301	0.237225568292209	TF:M00803_1	TF	Factor: E2F; motif: GGCGSG; match class: 1	19917	1477	1.22214734704499
query_1	TRUE	3.0516433757571e-53	8242	3858	2035	0.527475375842405	0.246906090754671	TF:M12351_1	TF	Factor: TIEG1; motif: NCCCNSNCCCCGCCCCC; match class: 1	19917	8389	1.27465749340611
query_1	TRUE	8.6665575089518e-53	10721	3854	2510	0.651271406331085	0.234119951497062	TF:M07395	TF	Factor: Sp1; motif: NGGGGCGGGGN	19917	7506	1.20990323662869
query_1	TRUE	7.39612648014829e-52	10571	3866	2485	0.642783238489395	0.235077097720178	TF:M10072	TF	Factor: sp4; motif: NNGNARGRGGCGGRGCNNRR	19917	7550	1.21107877788225
query_1	TRUE	1.20098119663269e-51	10490	3854	2462	0.638816813700052	0.234699714013346	TF:M00932	TF	Factor: Sp1; motif: NNGGGGCGGGGNN	19917	7510	1.21289937830924
query_1	TRUE	4.74757131045752e-51	10344	3854	2432	0.631032693305656	0.235112142304718	TF:M00931	TF	Factor: Sp1; motif: GGGGCGGGGC	19917	7514	1.21503075720889
query_1	TRUE	1.51074125304305e-50	9772	3856	2322	0.602178423236514	0.237617683176422	TF:M00933	TF	Factor: Sp1; motif: CCCCGCCCCN	19917	7504	1.22734216696701
query_1	TRUE	3.66784433799038e-50	13289	3931	3021	0.768506741287204	0.227330875159907	TF:M00803	TF	Factor: E2F; motif: GGCGSG	19917	1476	1.15180591212411
query_1	TRUE	4.88547868483286e-48	10947	3842	2526	0.657470067673087	0.230748150178131	TF:M07206_1	TF	Factor: E2F-1; motif: NGGGCGGGARV; match class: 1	19917	1375	1.19620273479902
query_1	TRUE	1.27078558798198e-46	15130	3920	3321	0.84719387755102	0.219497686715136	TF:M08526_1	TF	Factor: E2F-3:HES-7; motif: NNNSGCGCSNNNNNCRCGYGNN; match class: 1	19917	1417	1.11523862915953
query_1	TRUE	1.45061869690197e-46	6142	3853	1578	0.409550999221386	0.256919570172582	TF:M09723_1	TF	Factor: BTEB1; motif: GGGGGCGGGGCNGSGGGNGS; match class: 1	19917	585	1.32807346979686
query_1	TRUE	1.64487358828574e-46	6076	3853	1564	0.405917466908902	0.257406188281764	TF:M00932_1	TF	Factor: Sp1; motif: NNGGGGCGGGGNN; match class: 1	19917	7511	1.33058890527067
query_1	TRUE	4.80127877987618e-46	8460	3853	2046	0.531014793667272	0.241843971631206	TF:M03807	TF	Factor: SP2; motif: GNNGGGGGCGGGGSN	19917	7536	1.25014440253795
query_1	TRUE	5.7475629573034e-46	14202	3844	3102	0.806971904266389	0.218419940853401	TF:M09636_1	TF	Factor: MAZ; motif: GGGMGGGGSSGGGGGGGGGGGG; match class: 1	19917	4783	1.13170394432289
query_1	TRUE	8.37642789421304e-46	12403	3844	2785	0.724505723204995	0.224542449407401	TF:M12351	TF	Factor: TIEG1; motif: NCCCNSNCCCCGCCCCC	19917	8388	1.16342662977295
query_1	TRUE	2.35198092133931e-45	13735	3863	3033	0.785141082060575	0.220822715689843	TF:M07039_1	TF	Factor: ETF; motif: CCCCGCCCCYN; match class: 1	19917	2071	1.13852602340011
query_1	TRUE	5.89863146313126e-45	10315	3888	2420	0.622427983539095	0.234609791565681	TF:M04869_1	TF	Factor: Egr-1; motif: GCGCATGCG; match class: 1	19917	1533	1.2018321035529
query_1	TRUE	6.46708858422701e-45	14305	3843	3115	0.810564663023679	0.217756029360364	TF:M00986	TF	Factor: Churchill; motif: CGGGNN	19917	794	1.12855759478802
query_1	TRUE	1.02760238005778e-44	6376	3842	1615	0.420353982300885	0.253293601003764	TF:M07395_1	TF	Factor: Sp1; motif: NGGGGCGGGGN; match class: 1	19917	7507	1.31307877438625
query_1	TRUE	1.72681181192554e-44	8550	3853	2057	0.533869711912795	0.240584795321637	TF:M10071	TF	Factor: Sp1; motif: NGGGGGCGGGGCCNGGGGGGGG	19917	7496	1.24363544469791
query_1	TRUE	6.49223871639906e-44	12512	3916	2845	0.726506639427988	0.227381713554987	TF:M00333_1	TF	Factor: ZF5; motif: NRNGNGCGCGCWN; match class: 1	19917	8801	1.15647640165339
query_1	TRUE	1.04858070960413e-43	5934	3842	1519	0.395366996356065	0.255982473879339	TF:M00931_1	TF	Factor: Sp1; motif: GGGGCGGGGC; match class: 1	19917	7515	1.32701794176335
query_1	TRUE	2.26646557586157e-43	7557	3862	1858	0.481097876747799	0.245864761148604	TF:M09826_1	TF	Factor: BTEB3; motif: CCNNSCCNSCCCCKCCCCC; match class: 1	19917	599	1.26796697250045
query_1	TRUE	4.34687704286667e-43	9820	3874	2309	0.596024780588539	0.235132382892057	TF:M02036	TF	Factor: WT1; motif: CGCCCCCNCN	19917	8582	1.20886207280875
query_1	TRUE	4.45851893488553e-43	8336	3876	2019	0.520897832817337	0.242202495201536	TF:M03893	TF	Factor: WT1; motif: GNGGGGGCGGGG	19917	8584	1.24456839446052
query_1	TRUE	4.67757352761916e-43	10500	3842	2421	0.63014055179594	0.230571428571429	TF:M00695	TF	Factor: ETF; motif: GVGGMGG	19917	2068	1.19528660667807
query_1	TRUE	6.57538457926929e-43	11560	3863	2631	0.681076883251359	0.227595155709343	TF:M09826	TF	Factor: BTEB3; motif: CCNNSCCNSCCCCKCCCCC	19917	598	1.17344362315894
query_1	TRUE	1.56655299708196e-42	7866	3861	1916	0.496244496244496	0.243579964403763	TF:M00982	TF	Factor: KROX; motif: CCCGCCCCCRCCCC	19917	4418	1.25650923362594
query_1	TRUE	6.46594296863569e-42	7770	3854	1891	0.490659055526726	0.243371943371943	TF:M09970	TF	Factor: KLF3; motif: NNNNNNGGGCGGGGCNNGN	19917	4380	1.25771639754515
query_1	TRUE	2.24891555891709e-41	7842	3861	1906	0.493654493654494	0.243050242285131	TF:M07354	TF	Factor: Egr-1; motif: GCGGGGGCGG	19917	1550	1.25377665775523
query_1	TRUE	2.99874583511344e-41	5949	3849	1514	0.39334892179787	0.254496554042696	TF:M00196_1	TF	Factor: Sp1; motif: NGGGGGCGGGGYN; match class: 1	19917	7513	1.31691552789514
query_1	TRUE	6.6175016690017e-41	6272	3853	1581	0.410329613288347	0.252072704081633	TF:M10072_1	TF	Factor: sp4; motif: NNGNARGRGGCGGRGCNNRR; match class: 1	19917	7551	1.30301895852423
query_1	TRUE	1.15075915214928e-40	5650	3780	1427	0.377513227513228	0.252566371681416	TF:M01104_1	TF	Factor: MOVO-B; motif: GNGGGGG; match class: 1	19917	5007	1.33078423935946
query_1	TRUE	4.99704888725178e-40	10336	3843	2377	0.618527192297684	0.229972910216718	TF:M01104	TF	Factor: MOVO-B; motif: GNGGGGG	19917	5006	1.19187365412084
query_1	TRUE	1.18118866675393e-39	11319	3888	2587	0.665380658436214	0.228553759166004	TF:M04869	TF	Factor: Egr-1; motif: GCGCATGCG	19917	1532	1.17080895609807
query_1	TRUE	2.99930470969038e-39	8535	3850	2029	0.527012987012987	0.237727006444054	TF:M01199	TF	Factor: RNF96; motif: BCCCGCRGCC	19917	6970	1.22982046424577
query_1	TRUE	4.77893988913556e-39	7746	3849	1871	0.486100285788516	0.241544022721405	TF:M03567	TF	Factor: Sp2; motif: NYSGCCCCGCCCCCY	19917	7534	1.24989147844693
query_1	TRUE	5.97810730483649e-39	9248	3842	2163	0.562988027069235	0.233888408304498	TF:M09892_1	TF	Factor: E2F-1; motif: NNNNGGCGGGAARN; match class: 1	19917	1377	1.2124818917753
query_1	TRUE	6.09653140967503e-39	10502	3929	2452	0.62407737337745	0.233479337269092	TF:M08205_1	TF	Factor: E2F-1:Elk-1; motif: SGCGCSNNAMCGGAAGT; match class: 1	19917	1365	1.18356018335162
query_1	TRUE	2.06171068617611e-38	8046	3872	1938	0.50051652892562	0.240865026099925	TF:M07380_1	TF	Factor: E2F-4; motif: NTTTCSCGCC; match class: 1	19917	1447	1.23897436075212
query_1	TRUE	4.10622909928096e-38	8539	3849	2024	0.525850870355937	0.237030097201077	TF:M07277	TF	Factor: BTEB2; motif: RGGGNGKGGN	19917	596	1.22653376096489
query_1	TRUE	6.82232338493675e-38	13293	3842	2910	0.757418011452369	0.218912209433536	TF:M11603_1	TF	Factor: TCF-1; motif: ACATCGRGRCGCTGW; match class: 1	19917	8043	1.13484499617068
query_1	TRUE	2.78274485464953e-37	13661	3876	2997	0.773219814241486	0.219383646877974	TF:M09892	TF	Factor: E2F-1; motif: NNNNGGCGGGAARN	19917	1376	1.12731271797436
query_1	TRUE	3.43753705681652e-37	16373	3931	3505	0.891630628338845	0.214071947718805	TF:M10438	TF	Factor: ZF5; motif: GGSGCGCGS	19917	8794	1.0846275712835
query_1	TRUE	3.98610414421841e-37	7736	3849	1860	0.483242400623539	0.240434332988625	TF:M07063	TF	Factor: Sp1; motif: GGGGCGGGGC	19917	7508	1.24414928816171
query_1	TRUE	3.98610414421841e-37	7736	3849	1860	0.483242400623539	0.240434332988625	TF:M10435	TF	Factor: Sp2; motif: GGGGCGGGG	19917	7528	1.24414928816171
query_1	TRUE	9.36942092756815e-37	8333	3858	1981	0.513478486262312	0.237729509180367	TF:M07226	TF	Factor: SP1; motif: NCCCCKCCCCC	19917	7492	1.22728321263488
query_1	TRUE	9.57028183826848e-37	9160	3843	2136	0.555815768930523	0.233187772925764	TF:M03876_1	TF	Factor: Kaiso; motif: GCMGGGRGCRGS; match class: 1	19917	4337	1.20853522595952
query_1	TRUE	9.92917441150529e-37	10034	3876	2322	0.599071207430341	0.231413195136536	TF:M09896	TF	Factor: E2F-7; motif: GRGGCGGGAANNN	19917	1458	1.18912709172714
query_1	TRUE	1.77383903018359e-36	7067	3869	1730	0.447143964848798	0.244799773595585	TF:M00695_1	TF	Factor: ETF; motif: GVGGMGG; match class: 1	19917	2069	1.26019051194192
query_1	TRUE	2.97811160505209e-36	5191	3853	1334	0.34622372177524	0.256983240223464	TF:M00933_1	TF	Factor: Sp1; motif: CCCCGCCCCN; match class: 1	19917	7505	1.32840259422028
query_1	TRUE	8.37571828872552e-36	7518	3849	1810	0.470252013510003	0.240755520085129	TF:M09765	TF	Factor: SP1; motif: NRGKGGGCGGGGCN	19917	7494	1.24581129995727
query_1	TRUE	1.81033411811239e-35	12880	3850	2831	0.735324675324675	0.219798136645963	TF:M04823	TF	Factor: E2F-4; motif: NNTTCCCGCCNN	19917	1438	1.13706999677341
query_1	TRUE	4.17702624399565e-35	8931	3842	2083	0.542165538781884	0.233232560743478	TF:M06948	TF	Factor: Sp2; motif: TGGGCGCGCCCA	19917	7522	1.20908196572823
query_1	TRUE	4.8906229193145e-35	5308	3879	1361	0.350863624645527	0.256405425772419	TF:M02036_1	TF	Factor: WT1; motif: CGCCCCCNCN; match class: 1	19917	8583	1.31653180332799
query_1	TRUE	1.32489006212399e-34	15410	3931	3334	0.84813024675655	0.21635301752109	TF:M08525_1	TF	Factor: E2F-1:HES-7; motif: GGCRCGTGSYNNWNGGCGCSM; match class: 1	19917	1369	1.09618495292993
query_1	TRUE	2.14790935946537e-34	10922	3843	2461	0.640385115794952	0.225325032045413	TF:M09973	TF	Factor: CPBP; motif: GNNRGGGHGGGGNNGGGRN	19917	900	1.1677852363384
query_1	TRUE	2.58498612317809e-34	10945	3838	2462	0.641479937467431	0.22494289629968	TF:M07084	TF	Factor: E2F-4; motif: NGGCGGGAARN	19917	1440	1.16732351891629
query_1	TRUE	1.1854193935567e-33	10687	3862	2424	0.627654065251165	0.226817628894919	TF:M00189	TF	Factor: AP-2; motif: MKCCCSCNGGCG	19917	152	1.16973762679961
query_1	TRUE	1.33342500973118e-33	7527	3861	1806	0.467754467754468	0.239936229573535	TF:M08878	TF	Factor: EGR; motif: CGCCCCCGCNN	19917	1590	1.23771299777677
query_1	TRUE	2.73325059003273e-33	16345	3931	3487	0.887051640803867	0.213337412052615	TF:M09894	TF	Factor: E2F-4; motif: SNGGGCGGGAANN	19917	1442	1.08090593636529
query_1	TRUE	3.4632749447411e-33	3803	3879	1027	0.264758958494457	0.270049960557455	TF:M09970_1	TF	Factor: KLF3; motif: NNNNNNGGGCGGGGCNNGN; match class: 1	19917	4381	1.38659063274628
query_1	TRUE	6.73088094798047e-33	15217	3916	3282	0.838100102145046	0.215679831767103	TF:M00333	TF	Factor: ZF5; motif: NRNGNGCGCGCWN	19917	8800	1.09695996151823
query_1	TRUE	1.39559466311409e-32	6773	3866	1650	0.426797723745473	0.243614351099956	TF:M01873	TF	Factor: Egr-1; motif: GCGGGGGCGG	19917	1552	1.25506131165489
query_1	TRUE	2.63910867083988e-32	8085	3158	1600	0.506649778340722	0.197897340754484	TF:M12160_1	TF	Factor: KLF15; motif: RCCMCRCCCMCN; match class: 1	19917	4363	1.24810681944492
query_1	TRUE	2.75864411951501e-32	8285	3866	1953	0.505173305742369	0.235727217863609	TF:M10530	TF	Factor: sp4; motif: NNNGCYCCGCCCCCY	19917	7552	1.21442809058187
query_1	TRUE	3.01482675735305e-32	4390	3853	1145	0.297171035556709	0.260820045558087	TF:M10432_1	TF	Factor: MAZ; motif: GGGMGGGGS; match class: 1	19917	4787	1.3482358804517
query_1	TRUE	3.19374595743723e-32	11153	3842	2493	0.648880791254555	0.223527302071192	TF:M11601_1	TF	Factor: TCF-1; motif: ACATCGRGRCGCTGW; match class: 1	19917	8039	1.15876972289222
query_1	TRUE	3.46794835745491e-32	6648	3862	1621	0.419730709476955	0.243832731648616	TF:M09973_1	TF	Factor: CPBP; motif: GNNRGGGHGGGGNNGGGRN; match class: 1	19917	901	1.25748744594653
query_1	TRUE	5.02375309807033e-32	4992	3840	1269	0.33046875	0.254206730769231	TF:M12173_1	TF	Factor: GKLF; motif: NNCCMCRCCCN; match class: 1	19917	4395	1.31849881685697
query_1	TRUE	1.06575613130575e-31	4335	3842	1128	0.29359708485164	0.260207612456747	TF:M01199_1	TF	Factor: RNF96; motif: BCCCGCRGCC; match class: 1	19917	6971	1.34892113932875
query_1	TRUE	1.35904069388555e-31	7935	3848	1872	0.486486486486487	0.235916824196597	TF:M01303	TF	Factor: SP1; motif: GGGGYGGGGNS	19917	7484	1.22109027742298
query_1	TRUE	1.50407863084021e-31	8440	3853	1974	0.512328056060213	0.233886255924171	TF:M10026	TF	Factor: PATZ; motif: GGGGNGGGGGMKGGRRNGGNRN	19917	6036	1.20900922897527
query_1	TRUE	2.66497534832952e-31	14705	3920	3189	0.813520408163265	0.216865011900714	TF:M07206	TF	Factor: E2F-1; motif: NGGGCGGGARV	19917	1374	1.10186235765983
query_1	TRUE	4.25831960071686e-31	6114	3842	1499	0.390161374284227	0.245175008177952	TF:M00189_1	TF	Factor: AP-2; motif: MKCCCSCNGGCG; match class: 1	19917	153	1.27099183703287
query_1	TRUE	1.07878916548175e-30	7916	3842	1861	0.484383133784487	0.235093481556342	TF:M04823_1	TF	Factor: E2F-4; motif: NNTTCCCGCCNN; match class: 1	19917	1439	1.21872901409621
query_1	TRUE	3.3237222925187e-30	6518	3886	1593	0.409933093154915	0.244400122737036	TF:M02281	TF	Factor: SP1; motif: CCCCKCCCCC	19917	7486	1.25262924460976
query_1	TRUE	3.5849431995211e-30	6221	3876	1528	0.39422084623323	0.245619675293361	TF:M07208	TF	Factor: EGR1; motif: NCNCCGCCCCCGCN	19917	1538	1.26212772776519
query_1	TRUE	4.01720499835415e-30	6041	3169	1253	0.395392868412749	0.207415990730012	TF:M12158_1	TF	Factor: KLF15; motif: NCCMCGCCCMCN; match class: 1	19917	4359	1.30359870223087
query_1	TRUE	4.56537450782396e-30	9328	3851	2139	0.555440145416775	0.229309605488851	TF:M10432	TF	Factor: MAZ; motif: GGGMGGGGS	19917	4786	1.18596712867345
query_1	TRUE	5.74022536559948e-30	4924	3862	1251	0.323925427239772	0.254061738424046	TF:M10026_1	TF	Factor: PATZ; motif: GGGGNGGGGGMKGGRRNGGNRN; match class: 1	19917	6037	1.3102401978746
query_1	TRUE	6.08132890103684e-30	6869	3876	1660	0.42827657378741	0.241665453486679	TF:M01118	TF	Factor: WT1; motif: SMCNCCNSC	19917	8580	1.24180878150005
query_1	TRUE	1.54937386619956e-29	9222	3874	2127	0.549044914816727	0.230644111906311	TF:M01783	TF	Factor: SP2; motif: GGGCGGGAC	19917	7516	1.18578698421218
query_1	TRUE	2.07120061545278e-29	16245	3931	3456	0.879165606715848	0.212742382271468	TF:M00716	TF	Factor: ZF5; motif: GSGCGCGR	19917	8790	1.07789112889871
query_1	TRUE	2.63572967311376e-29	4641	3879	1192	0.307295694766692	0.256841198017669	TF:M10071_1	TF	Factor: Sp1; motif: NGGGGGCGGGGCCNGGGGGGGG; match class: 1	19917	7497	1.31876930675893
query_1	TRUE	3.3821565041642e-29	3531	3821	938	0.245485475006543	0.26564712546021	TF:M00982_1	TF	Factor: KROX; motif: CCCGCCCCCRCCCC; match class: 1	19917	4419	1.38468824857132
query_1	TRUE	3.86286631629341e-29	8758	3866	2030	0.525090532850491	0.231788079470199	TF:M04953	TF	Factor: Sp1; motif: GGNDGGRGGCGGGG	19917	7490	1.19413429353542
query_1	TRUE	4.66180957286331e-29	6856	3866	1649	0.426539058458355	0.240519253208868	TF:M01219	TF	Factor: SP1:SP3; motif: CCSCCCCCYCC	19917	7480	1.23911587329566
query_1	TRUE	5.43669091783553e-29	7460	3844	1762	0.45837669094693	0.236193029490617	TF:M01858	TF	Factor: AP-2beta; motif: GCNNNGGSCNGVGGGN	19917	134	1.22379203131233
query_1	TRUE	6.81677808391687e-29	7190	3856	1712	0.443983402489627	0.238108484005563	TF:M07397	TF	Factor: ZBP89; motif: CCCCKCCCCCNN	19917	8662	1.22987724998413
query_1	TRUE	7.20274128377385e-29	4169	3853	1082	0.280820140150532	0.25953466059007	TF:M07277_1	TF	Factor: BTEB2; motif: RGGGNGKGGN; match class: 1	19917	597	1.34159144432194
query_1	TRUE	9.05251945576861e-29	14560	3916	3149	0.804136874361593	0.216277472527473	TF:M08205	TF	Factor: E2F-1:Elk-1; motif: SGCGCSNNAMCGGAAGT	19917	1364	1.09999959661125
query_1	TRUE	9.96859965549255e-29	12836	3844	2787	0.725026014568158	0.21712371455282	TF:M12160	TF	Factor: KLF15; motif: RCCMCRCCCMCN	19917	4362	1.12498777907089
query_1	TRUE	1.16693748479444e-28	16407	3920	3471	0.885459183673469	0.211556043152313	TF:M11529	TF	Factor: E2F-2; motif: GCGCGCGCNCS	19917	1402	1.07488819170016
query_1	TRUE	1.24921429171448e-28	13334	3879	2901	0.747873163186388	0.21756412179391	TF:M01240_1	TF	Factor: BEN; motif: CAGCGRNV; match class: 1	19917	481	1.11709837941978
query_1	TRUE	1.52311971356339e-28	3627	3879	968	0.249548852797113	0.26688723462917	TF:M03567_1	TF	Factor: Sp2; motif: NYSGCCCCGCCCCCY; match class: 1	19917	7535	1.37035139265511
query_1	TRUE	1.74390295618605e-28	12267	3923	2733	0.696660718837624	0.222792858889704	TF:M04515_1	TF	Factor: E2F-1; motif: WWTGGCGCCAAA; match class: 1	19917	1371	1.13111531239007
query_1	TRUE	2.0730053314432e-28	6845	3849	1637	0.425305274097168	0.239152666179693	TF:M07615	TF	Factor: Sp3; motif: GGGGCGGGGSNN	19917	7546	1.23751718687996
query_1	TRUE	2.56008724103495e-28	4218	3853	1090	0.282896444329094	0.25841631104789	TF:M03807_1	TF	Factor: SP2; motif: GNNGGGGGCGGGGSN; match class: 1	19917	7537	1.33581045085409
query_1	TRUE	3.11883991482639e-28	9168	3861	2103	0.544677544677545	0.229384816753927	TF:M08911	TF	Factor: CTCF; motif: NCCRSTAGGGGGCGC	19917	1086	1.18328344866303
query_1	TRUE	4.73004750260847e-28	8620	3836	1983	0.516944734098019	0.230046403712297	TF:M04863_1	TF	Factor: TF3C-beta; motif: CCNGGAGGGCTTCCTGGAGGAG; match class: 1	19917	3159	1.194430193623
query_1	TRUE	4.76341422603063e-28	13143	3877	2862	0.738199638896054	0.217758502624971	TF:M07380	TF	Factor: E2F-4; motif: NTTTCSCGCC	19917	1446	1.11867322589155
query_1	TRUE	5.2862580597763e-28	13561	3931	2976	0.757059272449758	0.219452842710715	TF:M11530_1	TF	Factor: E2F-2; motif: NWTTTGGCGCCAWWNN; match class: 1	19917	1405	1.1118906813201
query_1	TRUE	5.65128064336255e-28	10131	3863	2289	0.592544654413668	0.225940183594907	TF:M00008	TF	Factor: Sp1; motif: GGGGCGGGGT	19917	7482	1.16491085598233
query_1	TRUE	6.01998359592913e-28	5470	3842	1350	0.351379489849037	0.246800731261426	TF:M07084_1	TF	Factor: E2F-4; motif: NGGCGGGAARN; match class: 1	19917	1441	1.27941961596403
query_1	TRUE	7.61381968451299e-28	11151	3842	2470	0.642894325871942	0.221504797775984	TF:M12227	TF	Factor: ZIC4; motif: NNCCNCCCRYNGYGN	19917	8928	1.14828502272365
query_1	TRUE	9.06141400960719e-28	3931	3842	1023	0.266267568974492	0.260239124904604	TF:M07226_1	TF	Factor: SP1; motif: NCCCCKCCCCC; match class: 1	19917	7493	1.34908450044899
query_1	TRUE	4.08570650665187e-27	6153	3929	1516	0.385848816492746	0.246383877783195	TF:M03896	TF	Factor: EGR1; motif: NACGCCCACGCANW	19917	1528	1.24897625192362
query_1	TRUE	1.01648165520327e-26	7857	3842	1828	0.475793857365955	0.232658775614102	TF:M09895	TF	Factor: E2F-6; motif: NGGGCGGGARRNN	19917	1454	1.20610745286467
query_1	TRUE	1.10451246628605e-26	7463	3856	1755	0.455134854771784	0.235160123274822	TF:M08523_1	TF	Factor: E2F-1:TBR2; motif: NGGTGNNANGGCGCNNTNNCRNNN; match class: 1	19917	1367	1.21464838570141
query_1	TRUE	2.15346638309597e-26	9683	3869	2197	0.567846988886017	0.226892491996282	TF:M00915	TF	Factor: AP-2; motif: SNNNCCNCAGGCN	19917	154	1.16800665884982
query_1	TRUE	2.23356432606766e-26	8225	2528	1308	0.517405063291139	0.1590273556231	TF:M07040_1	TF	Factor: GKLF; motif: NNRRGRRNGNSNNN; match class: 1	19917	3027	1.25290658304798
query_1	TRUE	2.48451271421128e-26	5877	3194	1215	0.380400751408892	0.206738131699847	TF:M12313	TF	Factor: ZNF460; motif: NNACNCCCCCCNN	19917	9848	1.28916824328925
query_1	TRUE	2.56724635872539e-26	12848	3822	2762	0.722658294086866	0.214975093399751	TF:M08441_1	TF	Factor: AP-2gamma:Elk-1; motif: NGCCKNRGGSGRCGGAAGTG; match class: 1	19917	8209	1.12026659739478
query_1	TRUE	3.11572434939567e-26	6933	3862	1648	0.426721905748317	0.237703735756527	TF:M10529	TF	Factor: Sp1; motif: RGGGMGGRGSNGGGG	19917	7498	1.2258791571887
query_1	TRUE	3.28392432588849e-26	6297	3876	1523	0.392930856553148	0.241861203747816	TF:M07129	TF	Factor: Sp2; motif: GYCCCGCCYCYNNNN	19917	7524	1.24281465300445
query_1	TRUE	5.09851608086149e-26	9172	3860	2091	0.541709844559585	0.227976450065416	TF:M00800	TF	Factor: AP-2; motif: GSCCSCRGGCNRNRNN	19917	148	1.17632304558365
query_1	TRUE	5.40097453084797e-26	5297	3866	1311	0.339110191412312	0.24749858410421	TF:M09658	TF	Factor: Sp2; motif: GGSNNGGGGGCGGGGCCNGNGS	19917	7526	1.27507224511214
query_1	TRUE	6.56695043548679e-26	3525	3876	933	0.240712074303406	0.26468085106383	TF:M01303_1	TF	Factor: SP1; motif: GGGGYGGGGNS; match class: 1	19917	7485	1.3600744351492
query_1	TRUE	7.29613642034368e-26	6908	3833	1630	0.425254369945213	0.235958309206717	TF:M12183	TF	Factor: KLF14; motif: NRCCACRCCCMCN	19917	4350	1.22608443633451
query_1	TRUE	7.43156242837206e-26	10088	3850	2262	0.587532467532468	0.224226804123711	TF:M12173	TF	Factor: GKLF; motif: NNCCMCRCCCN	19917	4394	1.15998058642389
query_1	TRUE	8.19843815878246e-26	4625	3842	1162	0.302446642373764	0.251243243243243	TF:M01857_1	TF	Factor: AP-2alpha; motif: NGCCYSNNGSN; match class: 1	19917	133	1.30244968133151
query_1	TRUE	9.19986179295691e-26	11519	3915	2572	0.656960408684547	0.223283271117284	TF:M11882_1	TF	Factor: pax-6; motif: NYACGCNYSANYGMNCN; match class: 1	19917	6129	1.13592156087943
query_1	TRUE	1.03800427815819e-25	6998	3856	1656	0.429460580912863	0.236639039725636	TF:M09834	TF	Factor: ZNF148; motif: NNNNNNCCNNCCCCTCCCCCACCCN	19917	9050	1.22228728065754
query_1	TRUE	1.49026144433301e-25	8853	3879	2035	0.524619747357566	0.22986558228849	TF:M08487_1	TF	Factor: GCMa:Erg; motif: ATGCGGGCGGAARKG; match class: 1	19917	2905	1.18026109885018
query_1	TRUE	1.52973558225627e-25	10809	3931	2444	0.621724751971509	0.226107873068739	TF:M07250	TF	Factor: E2F-1; motif: NNNSSCGCSAANN	19917	1386	1.14560938893668
query_1	TRUE	1.57485600066595e-25	9223	3805	2071	0.544283837056505	0.224547327333839	TF:M01857	TF	Factor: AP-2alpha; motif: NGCCYSNNGSN	19917	132	1.17537690368149
query_1	TRUE	1.74584652225464e-25	11165	3856	2468	0.640041493775934	0.221047917599642	TF:M12158	TF	Factor: KLF15; motif: NCCMCGCCCMCN	19917	4358	1.14175606193778
query_1	TRUE	2.11826225373192e-25	6227	3676	1436	0.390642002176279	0.230608639794444	TF:M07436	TF	Factor: WT1; motif: NNGGGNGGGSGN	19917	8578	1.24946471131282
query_1	TRUE	2.2266082937182e-25	10645	2521	1606	0.637048790162634	0.150868952559887	TF:M07289_1	TF	Factor: GKLF; motif: NNNRGGNGNGGSN; match class: 1	19917	3029	1.19193055459551
query_1	TRUE	2.2438836909138e-25	4966	3858	1236	0.320373250388802	0.248892468787757	TF:M00008_1	TF	Factor: Sp1; motif: GGGGCGGGGT; match class: 1	19917	7483	1.28491220861735
query_1	TRUE	3.45132160994067e-25	9389	3855	2126	0.551491569390402	0.226435190116093	TF:M10426	TF	Factor: ctcf; motif: CCRSCAGGGGGCGCN	19917	1096	1.16988577990719
query_1	TRUE	5.16291005731e-25	7376	3878	1737	0.447911294481692	0.235493492407809	TF:M00938	TF	Factor: E2F-1; motif: TTGGCGCGRAANNGNM	19917	1382	1.20946980100215
query_1	TRUE	6.47836219885178e-25	14054	3873	3008	0.776658920733282	0.214031592429202	TF:M08487	TF	Factor: GCMa:Erg; motif: ATGCGGGCGGAARKG	19917	2904	1.10066285215916
query_1	TRUE	8.87374535466471e-25	4099	3886	1055	0.271487390633042	0.257379848743596	TF:M04953_1	TF	Factor: Sp1; motif: GGNDGGRGGCGGGG; match class: 1	19917	7491	1.31915451554972
query_1	TRUE	1.04203287943337e-24	5599	3862	1366	0.35370274469187	0.243972137881765	TF:M09984_1	TF	Factor: MAZ; motif: GGGGGAGGGGGNGRGRRRGNRG; match class: 1	19917	4785	1.25820638793141
query_1	TRUE	1.07414034365784e-24	5133	3842	1263	0.328735033836543	0.246054938632379	TF:M04797	TF	Factor: Egr-1; motif: CCGCCCMCG	19917	1530	1.27555341299872
query_1	TRUE	1.11272513219998e-24	4096	3856	1047	0.27152489626556	0.255615234375	TF:M10112_1	TF	Factor: Miz-1; motif: NNRGGWGGGGGAGGGGMRR; match class: 1	19917	4977	1.32030306614286
query_1	TRUE	1.12885772184488e-24	3997	3853	1025	0.266026472878277	0.256442331748812	TF:M03893_1	TF	Factor: WT1; motif: GNGGGGGCGGGG; match class: 1	19917	8585	1.32560651996914
query_1	TRUE	1.61155058446134e-24	6233	3842	1489	0.387558563248308	0.23888978020215	TF:M06948_1	TF	Factor: Sp2; motif: TGGGCGCGCCCA; match class: 1	19917	7523	1.23840909741963
query_1	TRUE	1.97958498748193e-24	5202	3856	1280	0.33195020746888	0.246059207996924	TF:M08867_1	TF	Factor: AP2; motif: GCCYGSGGSN; match class: 1	19917	151	1.27094430645092
