query	significant	p_value	term_size	query_size	intersection_size	precision	recall	term_id	source	term_name	effective_domain_size	source_order	enrichment
query_1	TRUE	3.20958936730516e-13	2732	3842	690	0.179593961478397	0.252562225475842	TF:M09895_1	TF	Factor: E2F-6; motif: NGGGCGGGARRNN; match class: 1	19917	1455	1.30928730994335
query_1	TRUE	3.46076040452315e-13	2498	3821	636	0.166448573671814	0.254603682946357	TF:M12183_1	TF	Factor: KLF14; motif: NRCCACRCCCMCN; match class: 1	19917	4351	1.32712419608547
query_1	TRUE	3.91526027849043e-13	3138	3860	780	0.202072538860104	0.248565965583174	TF:M02023_1	TF	Factor: MAZ; motif: NKGGGAGGGGRGGR; match class: 1	19917	4793	1.28256174521245
query_1	TRUE	4.21255448858669e-13	2562	3853	654	0.169737866597457	0.255269320843091	TF:M12151_1	TF	Factor: Sp1; motif: NWRGCCMCGCCCMCN; match class: 1	19917	7501	1.31954296995376
query_1	TRUE	4.91618475679895e-13	4355	3928	1053	0.268075356415479	0.241791044776119	TF:M12156	TF	Factor: Sp2; motif: NTAAGYCCCGCCCMCTN	19917	7532	1.22600617077545
query_1	TRUE	6.49387038036924e-13	2109	3876	556	0.143446852425181	0.263632053105737	TF:M03896_1	TF	Factor: EGR1; motif: NACGCCCACGCANW; match class: 1	19917	1529	1.35468513975928
query_1	TRUE	6.69716944938162e-13	992	2507	215	0.0857598723573993	0.216733870967742	TF:M09968_1	TF	Factor: KLF15; motif: RGGGMGGRGNNGGGGGNGG; match class: 1	19917	4355	1.72185421143379
query_1	TRUE	7.85146263545037e-13	1327	1453	179	0.123193392980041	0.134890730972118	TF:M09603_1	TF	Factor: Egr-1; motif: NNNNNGYGKGGGNGGGNN; match class: 1	19917	1541	1.84901492689034
query_1	TRUE	8.68787190704749e-13	4190	3839	996	0.259442563167492	0.237708830548926	TF:M01072	TF	Factor: HIC1; motif: NSNNNNTGCCCSSNN	19917	3252	1.23325000730476
query_1	TRUE	1.13287698052655e-12	3947	3679	910	0.247349823321555	0.230554851786167	TF:M09972_1	TF	Factor: BTEB2; motif: WGGGTGKGGCNGGN; match class: 1	19917	589	1.24815465697882
query_1	TRUE	1.61216342277599e-12	9912	3870	2151	0.555813953488372	0.217009685230024	TF:M00738	TF	Factor: E2F-4:DP-1; motif: TTTSGCGC	19917	1430	1.11684286840475
query_1	TRUE	1.62707111223372e-12	4558	2521	740	0.293534311781039	0.1623519087319	TF:M00444_1	TF	Factor: VDR; motif: GGGKNARNRRGGWSA; match class: 1	19917	8531	1.28265091876765
query_1	TRUE	1.93312385539501e-12	7333	3870	1643	0.424547803617571	0.224055638892677	TF:M00431	TF	Factor: E2F-1; motif: TTTSGCGS	19917	1390	1.15310495085929
query_1	TRUE	3.16287875209388e-12	17224	2532	2312	0.913112164296998	0.134231305155597	TF:M08525	TF	Factor: E2F-1:HES-7; motif: GGCRCGTGSYNNWNGGCGCSM	19917	1368	1.05587871436968
query_1	TRUE	3.22983936426885e-12	11788	2087	1403	0.67225682798275	0.119019341703427	TF:M09734	TF	Factor: ZNF692; motif: SYNGGSCCCASCCNC	19917	10498	1.13584486282087
query_1	TRUE	3.36941087202035e-12	2158	3866	562	0.145369891360579	0.260426320667285	TF:M03922_1	TF	Factor: SP4; motif: NWRGCCACGCCCMCTYN; match class: 1	19917	7549	1.34167383050448
query_1	TRUE	4.60985970870649e-12	4694	3853	1099	0.285232286529977	0.234128674904133	TF:M00736_1	TF	Factor: E2F-1:DP-1; motif: TTTCSCGC; match class: 1	19917	1361	1.21026234572168
query_1	TRUE	7.05349030224803e-12	2123	3853	551	0.143005450298469	0.259538389072068	TF:M10151	TF	Factor: EZI; motif: GGGGAGGGGRRGGRGRRGGRRR	19917	2270	1.34161071766114
query_1	TRUE	7.16060148703015e-12	13969	3931	2957	0.752225896718392	0.211683012384566	TF:M04106	TF	Factor: RUNX2; motif: NRACCGCAAACCGCAN	19917	7030	1.07252367277115
query_1	TRUE	7.73520699931914e-12	7220	3842	1605	0.417751171264966	0.222299168975069	TF:M03971_1	TF	Factor: ELK1; motif: NACTTCCGSCGGAAGYN; match class: 1	19917	1755	1.15240305790642
query_1	TRUE	9.88641100695828e-12	16517	3856	3358	0.870850622406639	0.203305685051765	TF:M11603	TF	Factor: TCF-1; motif: ACATCGRGRCGCTGW	19917	8042	1.05011393391494
query_1	TRUE	1.08845745315312e-11	3626	3855	874	0.226718547341115	0.24103695532267	TF:M12157	TF	Factor: KLF15; motif: RCCACGCCCCCC	19917	4356	1.24532633960094
query_1	TRUE	1.11548136079098e-11	8463	2198	1106	0.503184713375796	0.130686517783292	TF:M09724	TF	Factor: DATF1; motif: SNGGRRGCWGNGGG	19917	1134	1.18420535700174
query_1	TRUE	1.64294771604269e-11	13733	3873	2869	0.740769429382907	0.208912837690235	TF:M04863	TF	Factor: TF3C-beta; motif: CCNGGAGGGCTTCCTGGAGGAG	19917	3158	1.07433952705304
query_1	TRUE	1.91616198173717e-11	1574	1806	234	0.129568106312292	0.14866581956798	TF:M09761_1	TF	Factor: EGR1; motif: NGNGKGGGYGGNGS; match class: 1	19917	1543	1.63952221945485
query_1	TRUE	2.30236777594052e-11	7361	3844	1630	0.424037460978148	0.221437304714033	TF:M00245	TF	Factor: Egr-3; motif: NTGCGTGGGCGK	19917	1570	1.14733787668819
query_1	TRUE	4.12081982211803e-11	4145	3842	976	0.254034357105674	0.23546441495778	TF:M05432	TF	Factor: ZSCAN18; motif: TRRCGRCGNMCC	19917	11078	1.22065193980065
query_1	TRUE	4.76176297717932e-11	11390	3878	2428	0.626095925734915	0.213169446883231	TF:M03971	TF	Factor: ELK1; motif: NACTTCCGSCGGAAGYN	19917	1754	1.09481585187553
query_1	TRUE	4.7695294809428e-11	8102	3805	1757	0.461760840998686	0.216860034559368	TF:M11478_1	TF	Factor: AP-2beta; motif: NSCCNNNGGSN; match class: 1	19917	8201	1.13513832018894
query_1	TRUE	5.7620773004106e-11	2433	3824	610	0.159518828451883	0.250719276613235	TF:M07129_1	TF	Factor: Sp2; motif: GYCCCGCCYCYNNNN; match class: 1	19917	7525	1.30585142058206
query_1	TRUE	6.05131020042758e-11	9588	3931	2106	0.53574154159247	0.219649561952441	TF:M11052_1	TF	Factor: Hey2; motif: NNCACGYGNN; match class: 1	19917	3237	1.11288738880864
query_1	TRUE	6.26940816770302e-11	9597	3870	2077	0.536692506459948	0.216421798478691	TF:M00427	TF	Factor: E2F; motif: TTTSGCGS	19917	1490	1.11381730240313
query_1	TRUE	6.77636450024597e-11	11596	3931	2498	0.635461714576444	0.215419110037944	TF:M11066	TF	Factor: HES-7; motif: GNCACGYGNN	19917	3214	1.09145317085366
query_1	TRUE	6.82609613930380e-11	1838	3770	474	0.125729442970822	0.257889009793254	TF:M07409_1	TF	Factor: BTEB2; motif: GCCCCRCCCH; match class: 1	19917	4399	1.36243379523932
query_1	TRUE	8.34131044584671e-11	6972	3930	1580	0.402035623409669	0.226620768789443	TF:M00516	TF	Factor: E2F-1; motif: TTTSGCGCGMNR	19917	1474	1.14850021678864
query_1	TRUE	1.43157837290016e-10	209	1143	46	0.0402449693788276	0.220095693779904	GO:0009952	GO:BP	anterior/posterior pattern specification	18123	4265	3.48975875623203
query_1	TRUE	1.46662389065704e-10	1778	3187	400	0.125509883903357	0.224971878515186	TF:M00244_1	TF	Factor: NGFI-C; motif: WTGCGTGGGYGG; match class: 1	19917	5501	1.40595070736961
query_1	TRUE	1.5272649330098e-10	4781	743	268	0.360699865410498	0.0560552185735202	TF:M09738_1	TF	Factor: ZNF511; motif: GGRRGRGGCWGNG; match class: 1	19917	9949	1.5026269021922
query_1	TRUE	1.88151804614182e-10	902	3876	267	0.0688854489164087	0.296008869179601	TF:M07617_1	TF	Factor: Sp4; motif: SCCCCKCCCCCSN; match class: 1	19917	7555	1.52105486260323
query_1	TRUE	1.93650660240732e-10	3011	1448	322	0.222375690607735	0.106941215543009	TF:M09760_1	TF	Factor: DPF2; motif: NYCACYTCCYCNYYCY; match class: 1	19917	1293	1.47095869473074
query_1	TRUE	1.96302547706599e-10	3018	3789	726	0.191607284243864	0.240556660039761	TF:M09632	TF	Factor: Kaiso; motif: GNTCTCGCGAGRNNNNGGN	19917	8706	1.26449379731114
query_1	TRUE	2.01316355784401e-10	1764	3826	461	0.120491374803973	0.261337868480726	TF:M05327_1	TF	Factor: WT1; motif: NGCGGGGGGGTSMMCYN; match class: 1	19917	8575	1.36044598184282
query_1	TRUE	2.05022813050222e-10	2907	1448	313	0.216160220994475	0.107671138630891	TF:M09724_1	TF	Factor: DATF1; motif: SNGGRRGCWGNGGG; match class: 1	19917	1135	1.48099866582283
query_1	TRUE	2.06789253875007e-10	8554	3662	1775	0.484707809939924	0.20750526069675	TF:M12085	TF	Factor: ZNF501; motif: NNNCSACGCGAACAC	19917	9928	1.12858609429196
query_1	TRUE	2.37188063175184e-10	1948	3172	429	0.135245901639344	0.220225872689938	TF:M12153_1	TF	Factor: Sp3; motif: NGCCACGCCCMCN; match class: 1	19917	7541	1.38279908775709
query_1	TRUE	2.47225853909935e-10	5386	3894	1240	0.318438623523369	0.230226513182325	TF:M00243	TF	Factor: Egr-1; motif: WTGCGTGGGCGK	19917	1524	1.17756072497492
query_1	TRUE	2.52224864440217e-10	3823	2045	522	0.255256723716381	0.136541982736071	TF:M03811_1	TF	Factor: AP-2gamma; motif: GCCYNCRGSN; match class: 1	19917	143	1.3298321125449
query_1	TRUE	2.53566514060309e-10	618	1235	89	0.0720647773279352	0.144012944983819	TF:M10137	TF	Factor: ZBP99; motif: NGGNGGGGGAGGGGN	19917	8832	2.32251483825321
query_1	TRUE	2.87726751511909e-10	9572	3811	2037	0.534505379165573	0.212808190555788	TF:M11022	TF	Factor: IRX2a; motif: ACRYGNNNNACRYGT	19917	4204	1.11217547396999
query_1	TRUE	2.93226841020675e-10	3218	3836	775	0.202033368091762	0.2408328154133	TF:M05439_1	TF	Factor: RREB-1; motif: GGGWCSA; match class: 1	19917	7021	1.25043461537714
query_1	TRUE	3.20652552516925e-10	13223	3931	2804	0.713304502671076	0.212054753081752	TF:M11533	TF	Factor: E2F-1; motif: NTTTTGGCGCCAWWWN	19917	1378	1.0744071526658
query_1	TRUE	4.35633262065226e-10	4110	2510	661	0.263346613545817	0.160827250608272	TF:M07261_1	TF	Factor: LKLF; motif: GGGGTGGKSN; match class: 1	19917	4573	1.27617384476692
query_1	TRUE	4.38618747939127e-10	10966	3931	2369	0.602645637242432	0.216031369688127	TF:M11535	TF	Factor: E2F-4; motif: TTTTGGCGCCAWWN	19917	1444	1.09455527603114
query_1	TRUE	5.84070676186699e-10	12046	3928	2681	0.682535641547862	0.222563506558194	GO:0043231	GO:CC	intracellular membrane-bounded organelle	18964	2132	1.07451485192708
query_1	TRUE	6.08492459373731e-10	2583	3928	651	0.165733197556008	0.252032520325203	TF:M00938_1	TF	Factor: E2F-1; motif: TTGGCGCGRAANNGNM; match class: 1	19917	1383	1.2779357707019
query_1	TRUE	6.98274484762976e-10	6298	3808	1394	0.366071428571429	0.221340107970784	TF:M11022_1	TF	Factor: IRX2a; motif: ACRYGNNNNACRYGT; match class: 1	19917	4205	1.15767618972009
query_1	TRUE	7.2059111997452e-10	3380	3855	810	0.21011673151751	0.239644970414201	TF:M03914	TF	Factor: KLF16; motif: GMCACGCCCCC	19917	4366	1.23813459811664
query_1	TRUE	1.24067965255449e-09	6212	3636	1318	0.362486248624863	0.21216999356085	TF:M09817_1	TF	Factor: PAX5; motif: RNGCGTGACCNN; match class: 1	19917	6115	1.16220840532218
query_1	TRUE	1.25442483600598e-09	6496	3912	1467	0.375	0.225831280788177	TF:M00939	TF	Factor: E2F; motif: TTTSGCGSG	19917	1486	1.14976524014778
query_1	TRUE	1.57468158850429e-09	8544	1217	643	0.52834839769926	0.0752574906367041	TF:M09890	TF	Factor: ctcf; motif: YGGCCACCAGRKGGCRSYN	19917	1094	1.23163799590077
query_1	TRUE	1.80719004013454e-09	11168	3900	2385	0.611538461538462	0.21355659025788	TF:M00425	TF	Factor: E2F; motif: TTTCGCGC	19917	1478	1.09061707901697
query_1	TRUE	2.07397796672136e-09	2527	3925	635	0.161783439490446	0.251286110011872	TF:M05499_1	TF	Factor: LKLF; motif: NGGGCGG; match class: 1	19917	4567	1.27512495620546
query_1	TRUE	2.07397796672136e-09	2527	3925	635	0.161783439490446	0.251286110011872	TF:M05386_1	TF	Factor: KLF17; motif: NGGGCGG; match class: 1	19917	4373	1.27512495620546
query_1	TRUE	2.09630709162936e-09	8831	1833	958	0.522640480087289	0.108481485675461	TF:M07461	TF	Factor: KLF; motif: GGGNGGGG	19917	4410	1.17873745237216
query_1	TRUE	2.17794928284309e-09	2517	1014	207	0.20414201183432	0.0822407628128725	TF:M10134	TF	Factor: FPM315; motif: GGGAGGAGGRRGRGGRGGRR	19917	2696	1.61537403643391
query_1	TRUE	2.35386113534148e-09	8227	3849	1786	0.464016627695505	0.217090069284065	TF:M11066_1	TF	Factor: HES-7; motif: GNCACGYGNN; match class: 1	19917	3215	1.12335227589782
query_1	TRUE	2.49456208448428e-09	4651	3817	1099	0.287922452187582	0.236293270264459	GO:0012505	GO:CC	endomembrane system	18964	817	1.17397578655887
query_1	TRUE	2.64984812644108e-09	13784	3930	2902	0.738422391857506	0.21053395240859	TF:M08209	TF	Factor: E2F-3:FOXO6; motif: NAATGACACGCGCCCMC	19917	1414	1.06697321377147
query_1	TRUE	2.69247027571118e-09	3652	3930	878	0.223409669211196	0.240416210295728	TF:M00428_1	TF	Factor: E2F-1; motif: NKTSSCGC; match class: 1	19917	1381	1.21841467187278
query_1	TRUE	2.802777008449e-09	3473	1382	342	0.247467438494935	0.0984739418370285	TF:M08952_1	TF	Factor: NF-KAPPAB1; motif: NGGKRNTTYCCCN; match class: 1	19917	5453	1.41917908796534
query_1	TRUE	3.48951362929541e-09	11589	3801	2404	0.632465140752434	0.207438087841919	TF:M04710_1	TF	Factor: CHD2; motif: TCTCGCGAG; match class: 1	19917	797	1.08696248238556
query_1	TRUE	3.70837606802124e-09	9200	736	434	0.589673913043478	0.0471739130434783	TF:M01721	TF	Factor: PUR1; motif: GGGNCAGNN	19917	6732	1.27657992674858
query_1	TRUE	3.75798509087251e-09	16656	3915	3417	0.8727969348659	0.205151296829971	TF:M01240	TF	Factor: BEN; motif: CAGCGRNV	19917	480	1.04367774686144
query_1	TRUE	4.07416642238425e-09	2413	1443	264	0.182952182952183	0.10940737670949	TF:M01973_1	TF	Factor: PLAG1; motif: CCCCCKWNNNGGSCCC; match class: 1	19917	6343	1.51009474838733
query_1	TRUE	4.34346941844077e-09	8274	835	446	0.534131736526946	0.0539037950205463	TF:M09739	TF	Factor: ZGPAT; motif: GRGGCWGNGGNG	19917	8900	1.28575076098709
query_1	TRUE	5.145309094291e-09	2545	2423	422	0.174164259182831	0.165815324165029	TF:M12184	TF	Factor: KLF14; motif: NRCCACGCCCMCN	19917	4352	1.36299785860293
query_1	TRUE	6.10544497041874e-09	10956	2191	1358	0.619808306709265	0.123950346841913	TF:M09738	TF	Factor: ZNF511; motif: GGRRGRGGCWGNG	19917	9948	1.12675447651775
query_1	TRUE	6.45521205315563e-09	4387	3821	1005	0.263020151792724	0.22908593571917	TF:M00976	TF	Factor: AhR,; motif: NRCGTGNGN	19917	12	1.19411268822788
query_1	TRUE	6.62675187639738e-09	12619	3931	2678	0.681251589926227	0.212219668753467	TF:M11052	TF	Factor: Hey2; motif: NNCACGYGNN	19917	3236	1.07524272260565
query_1	TRUE	7.47528301895526e-09	13123	2492	1794	0.719903691813804	0.136706545759354	TF:M04595	TF	Factor: SALL2; motif: GGGTGGG	19917	7102	1.09261006095066
query_1	TRUE	8.07400391167048e-09	7216	3931	1613	0.41032816077334	0.223531042128603	TF:M11881_1	TF	Factor: pax-6; motif: NYACGCNTSANYGCNYN; match class: 1	19917	6127	1.13255348920768
query_1	TRUE	8.49480375243298e-09	7428	1966	876	0.44557477110885	0.117932148626817	TF:M04595_1	TF	Factor: SALL2; motif: GGGTGGG; match class: 1	19917	7103	1.19473784547321
query_1	TRUE	8.84935286177336e-09	10536	3899	2256	0.578609899974352	0.214123006833713	TF:M00740	TF	Factor: Rb:E2F-1:DP-1; motif: TTTSGCGC	19917	1358	1.09379018392076
query_1	TRUE	9.08114512173405e-09	14504	2512	1971	0.784633757961783	0.135893546607832	TF:M08266	TF	Factor: ER71:Pax-5; motif: ACCGGAACYACGCWTSANTG	19917	2138	1.07746487571186
query_1	TRUE	9.39059218575763e-09	3796	2499	607	0.242897158863545	0.159905163329821	TF:M04110_1	TF	Factor: RUNX3; motif: NRACCGCANWAACCRCAN; match class: 1	19917	7047	1.27444223210886
query_1	TRUE	1.12206870260681e-08	12013	3914	2549	0.651251916198263	0.212186797635894	TF:M00426	TF	Factor: E2F; motif: TTTSGCGS	19917	1482	1.07974564346298
query_1	TRUE	1.13159622220387e-08	9867	2510	1405	0.559760956175299	0.142393838046012	TF:M07261	TF	Factor: LKLF; motif: GGGGTGGKSN	19917	4572	1.12990361448702
query_1	TRUE	1.22823666304302e-08	3423	2221	501	0.225574065736155	0.146362839614373	TF:M07461_1	TF	Factor: KLF; motif: GGGNGGGG; match class: 1	19917	4411	1.31252079090476
query_1	TRUE	1.3026329830012e-08	2107	3519	504	0.143222506393862	0.239202657807309	GO:0030054	GO:CC	cell junction	18964	1026	1.28907053215624
query_1	TRUE	1.48702576170179e-08	2657	3809	641	0.1682856392754	0.241249529544599	TF:M02105	TF	Factor: NF-E4; motif: CHCCCTCKCCWG	19917	5422	1.26147725910732
query_1	TRUE	1.60009269480201e-08	5892	3930	1340	0.340966921119593	0.227427019687712	TF:M00426_1	TF	Factor: E2F; motif: TTTSGCGS; match class: 1	19917	1483	1.15258624710437
query_1	TRUE	1.62004389961678e-08	14245	3920	2975	0.758928571428571	0.208845208845209	TF:M04710	TF	Factor: CHD2; motif: TCTCGCGAG	19917	796	1.06111480218623
query_1	TRUE	1.68050932762885e-08	6527	3861	1446	0.374514374514375	0.221541290026046	TF:M03978_1	TF	Factor: ETS1; motif: GCCGGAWGTACTTCCGGN; match class: 1	19917	2075	1.14282255204578
query_1	TRUE	2.30082566277404e-08	3279	1340	314	0.234328358208955	0.0957609027142421	TF:M01587	TF	Factor: FPM315; motif: SRGGGAGGAGGN	19917	2694	1.42333574579072
query_1	TRUE	2.3440372864416e-08	2332	1608	277	0.17226368159204	0.118782161234991	TF:M10115_1	TF	Factor: LRF; motif: NRGGGKCKY; match class: 1	19917	8757	1.47125889634162
query_1	TRUE	2.39191385215149e-08	7781	3841	1686	0.438948190575371	0.216681660454954	TF:M04152	TF	Factor: TFAP2C; motif: NGCCCNNRGGCA	19917	8220	1.12357423360618
query_1	TRUE	2.42753410484266e-08	339	1143	57	0.0498687664041995	0.168141592920354	GO:0003002	GO:BP	regionalization	18123	1587	2.66599307829884
query_1	TRUE	2.54640800682276e-08	2041	3861	514	0.133126133126133	0.251837334639882	TF:M03899	TF	Factor: EGR4; motif: NNMCGCCCACGCANNN	19917	1584	1.29910494535678
query_1	TRUE	2.60020682413656e-08	5665	3832	1262	0.329331941544885	0.222771403353928	TF:M04918	TF	Factor: Egr-1; motif: ACCGCCC	19917	1534	1.15786483314201
query_1	TRUE	2.71287579871781e-08	838	3291	218	0.0662412640534792	0.260143198090692	GO:0070161	GO:CC	anchoring junction	18964	2765	1.4990445483415
query_1	TRUE	2.75996400439158e-08	996	2485	198	0.0796780684104628	0.198795180722892	TF:M09897_1	TF	Factor: Egr-1; motif: NNNNGCGKGGGYGGNRN; match class: 1	19917	1545	1.5933213740273
query_1	TRUE	2.87470333459587e-08	6582	3841	1448	0.376985160114554	0.219993922819812	TF:M04146	TF	Factor: TFAP2A; motif: YGCCCNNRGGCN	19917	8176	1.14074953418438
query_1	TRUE	2.97411230724752e-08	1421	2507	265	0.105704028719585	0.186488388458832	TF:M01837_1	TF	Factor: FKLF; motif: BGGGNGGVMD; match class: 1	19917	2315	1.4815673047206
query_1	TRUE	3.20368790341537e-08	1566	3876	410	0.10577915376677	0.261813537675607	TF:M04797_1	TF	Factor: Egr-1; motif: CCGCCCMCG; match class: 1	19917	1531	1.34534061658541
query_1	TRUE	3.67199317644147e-08	7112	3931	1586	0.403459679470873	0.223003374578178	TF:M11880_1	TF	Factor: pax-6; motif: NYACGCWTSANYGMNCN; match class: 1	19917	6125	1.12987998256768
query_1	TRUE	3.67759452504854e-08	5851	2497	879	0.352022426912295	0.15023072978978	TF:M11595_1	TF	Factor: GCMa; motif: RTGCGGGTN; match class: 1	19917	2945	1.19829613344935
query_1	TRUE	3.9247674425084e-08	6513	3931	1464	0.372424319511575	0.224781206817135	TF:M04107_1	TF	Factor: RUNX2; motif: WRACCGCANWAACCGCAN; match class: 1	19917	7033	1.1388876357611
query_1	TRUE	4.40500063466461e-08	6579	3931	1477	0.375731366064615	0.224502203982368	TF:M11535_1	TF	Factor: E2F-4; motif: TTTTGGCGCCAWWN; match class: 1	19917	1445	1.13747402612995
query_1	TRUE	4.6299971461546e-08	8075	3572	1627	0.45548712206047	0.201486068111455	TF:M08225_1	TF	Factor: Elk-1:Pax-5; motif: ACCGGAACYACGCWTSANYG; match class: 1	19917	1731	1.12345969165057
query_1	TRUE	5.7751003611024e-08	5599	3207	1059	0.33021515434986	0.189140918021075	TF:M04152_1	TF	Factor: TFAP2C; motif: NGCCCNNRGGCA; match class: 1	19917	8221	1.17465533652191
query_1	TRUE	6.56298684428792e-08	1593	3851	423	0.109841599584523	0.265536723163842	GO:0005794	GO:CC	Golgi apparatus	18964	438	1.30761838952976
query_1	TRUE	7.58882194592265e-08	6458	796	346	0.434673366834171	0.0535769588107773	TF:M00051	TF	Factor: NF-kappaB; motif: GGGGATYCCC	19917	5442	1.34056820180182
query_1	TRUE	7.59698714012601e-08	3813	2492	602	0.241573033707865	0.157880933648046	TF:M12139	TF	Factor: Egr-1; motif: NMCRCCCMCNCNN	19917	1546	1.26184372209797
query_1	TRUE	7.75556268054408e-08	6265	2494	930	0.3728949478749	0.148443735035914	TF:M00246	TF	Factor: Egr-2; motif: NTGCGTRGGCGK	19917	1554	1.18546666828801
query_1	TRUE	8.39541157976667e-08	16491	2520	2200	0.873015873015873	0.133406100297132	TF:M08441	TF	Factor: AP-2gamma:Elk-1; motif: NGCCKNRGGSGRCGGAAGTG	19917	8208	1.05438464270554
query_1	TRUE	8.61166132421856e-08	7203	3931	1601	0.407275502416688	0.222268499236429	TF:M00144_1	TF	Factor: Pax-5; motif: RRMSWGANWYCTNRAGCGKRACSRYNSM; match class: 1	19917	6103	1.1261566266324
query_1	TRUE	8.87536928884828e-08	1460	1685	196	0.116320474777448	0.134246575342466	TF:M04617_1	TF	Factor: LRF; motif: NGNAGNGGGTYN; match class: 1	19917	4605	1.58681842201537
query_1	TRUE	9.03630389654173e-08	4123	3839	946	0.246418338108883	0.22944457918991	TF:M01073	TF	Factor: HIC1; motif: NNNGGKTGCCCSNNNNNN	19917	3254	1.19037449432807
query_1	TRUE	9.50467982513416e-08	1565	2492	283	0.113563402889246	0.180830670926518	TF:M12140_1	TF	Factor: Egr-1; motif: NNCRCCCMCGCNN; match class: 1	19917	1549	1.44526664239304
query_1	TRUE	9.55154243888789e-08	6208	3912	1392	0.355828220858896	0.224226804123711	TF:M00919	TF	Factor: E2F; motif: NCSCGCSAAAN	19917	1484	1.14159643602555
query_1	TRUE	9.66537805272596e-08	12217	2520	1695	0.672619047619048	0.138741098469346	TF:M11595	TF	Factor: GCMa; motif: RTGCGGGTN	19917	2944	1.09655018183094
query_1	TRUE	9.77825655784345e-08	7671	2532	1127	0.445102685624013	0.146916959979142	TF:M10115	TF	Factor: LRF; motif: NRGGGKCKY	19917	8756	1.15566551812977
query_1	TRUE	1.02133312584671e-07	818	3688	227	0.0615509761388286	0.277506112469438	TF:M12157_1	TF	Factor: KLF15; motif: RCCACGCCCCCC; match class: 1	19917	4357	1.49866844958075
query_1	TRUE	1.03287695607764e-07	7780	1021	500	0.489715964740451	0.06426735218509	TF:M10491_1	TF	Factor: ZNF586; motif: CAGGCCYRGAGG; match class: 1	19917	10215	1.2536854588349
query_1	TRUE	1.11662931353702e-07	3974	3752	896	0.238805970149254	0.22546552591847	TF:M01200	TF	Factor: CTCF; motif: NNNGCCASCAGRKGGCRSNN	19917	1072	1.19685417902936
query_1	TRUE	1.1772415075605e-07	2382	3871	585	0.151123740635495	0.245591939546599	TF:M00245_1	TF	Factor: Egr-3; motif: NTGCGTGGGCGK; match class: 1	19917	1571	1.26361525702651
query_1	TRUE	1.19713997859289e-07	2070	3929	524	0.133367269025197	0.253140096618358	TF:M08700	TF	Factor: Erm:HES-7; motif: NCGGANGNNNNNCRCGYG	19917	2194	1.28322507109896
query_1	TRUE	1.29759658483605e-07	3644	3818	870	0.227867993713986	0.238748627881449	GO:0031090	GO:CC	organelle membrane	18964	1217	1.18586405949288
query_1	TRUE	1.32562734988676e-07	10612	3923	2273	0.579403517716034	0.214191481341877	TF:M03977	TF	Factor: ETS1; motif: ACCGGAARYN	19917	2072	1.08744627425087
query_1	TRUE	1.5016050031302e-07	576	1203	77	0.0640066500415628	0.133680555555556	TF:M10151_1	TF	Factor: EZI; motif: GGGGAGGGGRRGGRGRRGGRRR; match class: 1	19917	2271	2.21322994596841
query_1	TRUE	1.58414008138326e-07	2761	611	144	0.235679214402619	0.0521550162984426	TF:M01778	TF	Factor: PLAG1; motif: GRGGCNNHNNNRRGGG	19917	6340	1.7001169551818
query_1	TRUE	1.63339475608032e-07	5784	3927	1308	0.333078686019863	0.226141078838174	TF:M11541	TF	Factor: Foxn2; motif: NNGCGTCNNNNNGACGCNN	19917	2588	1.14694470772089
query_1	TRUE	1.72853799618276e-07	6318	3825	1383	0.36156862745098	0.218898385565052	TF:M11061	TF	Factor: HES-1; motif: GGCRCGTGNC	19917	3192	1.13981677001285
query_1	TRUE	1.79954036563726e-07	10400	255	184	0.72156862745098	0.0176923076923077	TF:M00444	TF	Factor: VDR; motif: GGGKNARNRRGGWSA	19917	8530	1.38187330316742
query_1	TRUE	1.83017921210286e-07	9352	3888	2007	0.516203703703704	0.214606501283148	TF:M04110	TF	Factor: RUNX3; motif: NRACCGCANWAACCRCAN	19917	7046	1.09936154476761
query_1	TRUE	1.94368540481342e-07	296	1928	66	0.0342323651452282	0.222972972972973	GO:0030135	GO:CC	coated vesicle	18964	1075	2.19318436693955
query_1	TRUE	2.29021043748345e-07	1764	3833	457	0.11922775893556	0.25907029478458	GO:0031984	GO:CC	organelle subcompartment	18964	1455	1.28176599798977
query_1	TRUE	2.45079834072716e-07	106	3243	45	0.0138760407030527	0.424528301886792	GO:0022626	GO:CC	cytosolic ribosome	18964	1015	2.48250222540275
query_1	TRUE	2.47621049781538e-07	9858	3879	2100	0.541376643464811	0.213024954351795	TF:M04109	TF	Factor: RUNX3; motif: NRACCGCAAACCGCAN	19917	7044	1.09379170297105
query_1	TRUE	2.66049280423639e-07	4665	341	133	0.390029325513196	0.0285101822079314	TF:M09729_1	TF	Factor: LUMAN; motif: CYCAGCYYCY; match class: 1	19917	4629	1.66521202063158
query_1	TRUE	2.68418478115119e-07	845	3833	243	0.0633968171145317	0.287573964497041	GO:0098791	GO:CC	Golgi apparatus subcompartment	18964	3624	1.42278963285205
query_1	TRUE	3.53770474649199e-07	427	3251	123	0.0378345124577053	0.288056206088993	GO:0030055	GO:CC	cell-substrate junction	18964	1027	1.68031310128319
query_1	TRUE	3.60782885991378e-07	5719	3912	1287	0.32898773006135	0.225039342542403	TF:M00920	TF	Factor: E2F; motif: NKCGCGCSAAAN	19917	1492	1.14573327848084
query_1	TRUE	3.88810354197266e-07	5579	3856	1287	0.333765560165975	0.230686502957519	GO:0031974	GO:CC	membrane-enclosed lumen	18964	1446	1.13452770800996
query_1	TRUE	3.88810354197266e-07	5579	3856	1287	0.333765560165975	0.230686502957519	GO:0070013	GO:CC	intracellular organelle lumen	18964	2720	1.13452770800996
query_1	TRUE	3.88810354197266e-07	5579	3856	1287	0.333765560165975	0.230686502957519	GO:0043233	GO:CC	organelle lumen	18964	2134	1.13452770800996
query_1	TRUE	3.96688815658164e-07	2957	3802	693	0.182272488164124	0.234359147784917	TF:M07348_1	TF	Factor: AP-2alpha; motif: NSCCNCRGGSN; match class: 1	19917	131	1.22770414161815
query_1	TRUE	4.78723134424201e-07	420	3251	121	0.0372193171331898	0.288095238095238	GO:0005925	GO:CC	focal adhesion	18964	550	1.68054078598526
query_1	TRUE	4.8680599587969e-07	5583	3841	1237	0.322051549075762	0.221565466595021	TF:M09971	TF	Factor: GKLF; motif: WGGGYGKGGC	19917	3024	1.14889856760558
query_1	TRUE	4.88841138903274e-07	4373	2511	677	0.269613699721227	0.154813629087583	TF:M00807	TF	Factor: Egr; motif: GTGGGSGCRRS	19917	1592	1.22796616907104
query_1	TRUE	5.13893366806503e-07	12479	3931	2634	0.670058509285169	0.211074605336966	TF:M04107	TF	Factor: RUNX2; motif: WRACCGCANWAACCGCAN	19917	7032	1.06944108738142
query_1	TRUE	5.37038288107178e-07	589	2674	135	0.0504861630516081	0.229202037351443	TF:M10134_1	TF	Factor: FPM315; motif: GGGAGGAGGRRGRGGRGGRR; match class: 1	19917	2697	1.70718660356346
query_1	TRUE	5.6761267239481e-07	3817	3841	877	0.228325956782088	0.229761592873985	TF:M04146_1	TF	Factor: TFAP2A; motif: YGCCCNNRGGCN; match class: 1	19917	8177	1.19139850176286
query_1	TRUE	6.4044279795195e-07	2483	2503	413	0.165001997602877	0.166331051147805	TF:M12147	TF	Factor: SP8; motif: RNCACGCCCMCN	19917	7568	1.32353797271707
