query	significant	p_value	term_size	query_size	intersection_size	precision	recall	term_id	source	term_name	effective_domain_size	source_order	enrichment
query_1	TRUE	7.10213504948474e-07	2987	1920	385	0.200520833333333	0.128891864747238	TF:M07297	TF	Factor: MAZ; motif: CCCTCCCYCYN	19917	4788	1.33705170321393
query_1	TRUE	8.26296709387404e-07	102	3681	49	0.0133116001086661	0.480392156862745	GO:0006613	GO:BP	cotranslational protein targeting to membrane	18123	2598	2.36515812518977
query_1	TRUE	8.80934777844057e-07	9802	3864	2076	0.537267080745342	0.21179351152826	TF:M08313_1	TF	Factor: GCMa:PEA3; motif: ATRCGGGCGGAAGTR; match class: 1	19917	2909	1.09169031291624
query_1	TRUE	8.90626786783976e-07	2158	3855	529	0.137224383916991	0.245134383688601	TF:M08874_1	TF	Factor: E2F1; motif: NNNNNGCGSSAAAN; match class: 1	19917	1389	1.26649585471488
query_1	TRUE	9.16115597539946e-07	10214	3929	2190	0.557393738864851	0.214411591932641	TF:M02071	TF	Factor: ETV7; motif: NCCGGAANNN	19917	2212	1.0869014193236
query_1	TRUE	9.16739907800849e-07	2807	828	182	0.219806763285024	0.0648379052369077	TF:M00051_1	TF	Factor: NF-kappaB; motif: GGGGATYCCC; match class: 1	19917	5443	1.55963352488344
query_1	TRUE	9.79013332931759e-07	2665	3876	640	0.165118679050568	0.24015009380863	TF:M10111	TF	Factor: ZF5; motif: NGAGCGCGC	19917	8792	1.23402203776741
query_1	TRUE	1.00673504449618e-06	7507	3191	1360	0.426198683798182	0.181164246703077	TF:M09602	TF	Factor: ctcf; motif: NNNCCASYAGRKGGCRSYNN	19917	1088	1.13075785070047
query_1	TRUE	1.03376132064211e-06	1983	3811	486	0.127525583836263	0.245083207261725	TF:M08662	TF	Factor: AP-2gamma:HES-7; motif: NNCACGYGNNNNNNSCCNNNGGS	19917	8212	1.28085075807708
query_1	TRUE	1.04674081120322e-06	177	2118	48	0.0226628895184136	0.271186440677966	GO:0030662	GO:CC	coated vesicle membrane	18964	1121	2.42813015156608
query_1	TRUE	1.05697505244394e-06	3005	3662	677	0.184871654833424	0.225291181364393	TF:M12085_1	TF	Factor: ZNF501; motif: NNNCSACGCGAACAC; match class: 1	19917	9929	1.22532071524703
query_1	TRUE	1.20697583467745e-06	9603	2519	1360	0.539896784438269	0.141622409663647	TF:M09910	TF	Factor: ER-beta; motif: RGGTCASCNTGMCCY	19917	2018	1.11976718271967
query_1	TRUE	1.21395709541051e-06	114	2118	36	0.0169971671388102	0.315789473684211	GO:0030665	GO:CC	clathrin-coated vesicle membrane	18964	1123	2.82749366333681
query_1	TRUE	1.22631030746788e-06	5526	3927	1247	0.317545199898141	0.22566051393413	TF:M11541_1	TF	Factor: Foxn2; motif: NNGCGTCNNNNNGACGCNN; match class: 1	19917	2589	1.14450737357424
query_1	TRUE	1.25019958347878e-06	7919	2250	1031	0.458222222222222	0.130193206212906	TF:M00322	TF	Factor: c-Myc:Max; motif: GCCAYGYGSN	19917	5144	1.15247026139664
query_1	TRUE	1.25607643626284e-06	550	355	34	0.0957746478873239	0.0618181818181818	TF:M01587_1	TF	Factor: FPM315; motif: SRGGGAGGAGGN; match class: 1	19917	2695	3.46826120358515
query_1	TRUE	1.36310677674891e-06	10863	3923	2312	0.589344889115473	0.21283255086072	TF:M11396	TF	Factor: Erg; motif: NACCGGAARTN	19917	1950	1.08054700879249
query_1	TRUE	1.3777459583942e-06	446	1143	64	0.0559930008748906	0.143497757847534	GO:0007389	GO:BP	pattern specification process	18123	3279	2.27524922613373
query_1	TRUE	1.38107737350194e-06	6803	3899	1497	0.38394460117979	0.220049977950904	TF:M11490	TF	Factor: LBP-1; motif: NRCCGGTNNNNACCGGYN	19917	4422	1.12406653266175
query_1	TRUE	1.50672588676848e-06	9306	3911	2000	0.511378164152391	0.21491510853213	TF:M01047	TF	Factor: AP-2alphaA; motif: ANMGCCTNAGGCKNT	19917	128	1.09446796641126
query_1	TRUE	1.50672588676848e-06	9306	3911	2000	0.511378164152391	0.21491510853213	TF:M01047_1	TF	Factor: AP-2alphaA; motif: ANMGCCTNAGGCKNT; match class: 1	19917	129	1.09446796641126
query_1	TRUE	1.57984429969886e-06	13117	3928	2864	0.729124236252546	0.218342608828238	GO:0043229	GO:CC	intracellular organelle	18964	2130	1.05413677032045
query_1	TRUE	1.62318064779329e-06	5645	2519	846	0.335847558554982	0.149867139061116	TF:M08819	TF	Factor: LKLF; motif: CNCCACCCS	19917	4574	1.18495585894412
query_1	TRUE	1.63130347649094e-06	712	3688	198	0.0536876355748373	0.278089887640449	TF:M03914_1	TF	Factor: KLF16; motif: GMCACGCCCCC; match class: 1	19917	4367	1.50182112042701
query_1	TRUE	1.63224403876657e-06	2928	2490	471	0.189156626506024	0.160860655737705	TF:M12148	TF	Factor: SP8; motif: NCCACGCCCMCN	19917	7570	1.28669143788268
query_1	TRUE	1.79127972607345e-06	11951	3821	2560	0.669981680188432	0.214208016065601	GO:0005737	GO:CC	cytoplasm	18964	385	1.06313551862551
query_1	TRUE	1.79933544380865e-06	3884	2444	592	0.242225859247136	0.152420185375901	TF:M03921	TF	Factor: SP3; motif: NCCACGCCCMC	19917	7538	1.24212472673152
query_1	TRUE	1.82912633161104e-06	10042	3923	2150	0.548049961763956	0.214100776737702	TF:M11400	TF	Factor: Fli-1; motif: NACCGGAARTN	19917	2352	1.08698576861708
query_1	TRUE	1.94729991478629e-06	1703	3726	416	0.111647879763822	0.244274809160305	TF:M12345_1	TF	Factor: Zbtb37; motif: NYACCGCRNTCACCGCR; match class: 1	19917	8715	1.30574916104289
query_1	TRUE	1.95410437512037e-06	1009	3621	260	0.071803369235018	0.257680872150644	TF:M12155_1	TF	Factor: Sp2; motif: NTWAGTCCCGCCCMCTT; match class: 1	19917	7531	1.4173515411832
query_1	TRUE	1.98393080515474e-06	2100	1915	284	0.148302872062663	0.135238095238095	TF:M12180	TF	Factor: BTEB3; motif: NRCCACGCCCMCN	19917	602	1.40654681089146
query_1	TRUE	2.01990160675383e-06	1223	1902	182	0.0956887486855941	0.148814390842191	TF:M00491	TF	Factor: MAZR; motif: NSGGGGGGGGMCN	19917	4780	1.55832608959197
query_1	TRUE	2.0877653505083e-06	10938	3927	2327	0.592564298446651	0.212744560248674	TF:M02070	TF	Factor: TEL1; motif: CNCGGAANNN	19917	8172	1.07900010350722
query_1	TRUE	2.36320391473364e-06	2210	1442	234	0.162274618585298	0.105882352941176	TF:M01816	TF	Factor: ZBP89; motif: YCCYCCCCCM	19917	8660	1.46245410785674
query_1	TRUE	2.46902115156579e-06	3230	1827	391	0.214012041598248	0.121052631578947	TF:M09727_1	TF	Factor: GEMIN3; motif: NCWGGRARRGRGNGNG; match class: 1	19917	2999	1.31965257972518
query_1	TRUE	2.4701926256135e-06	7213	3601	1464	0.406553735073591	0.202966865381949	TF:M09918_1	TF	Factor: Pet-1; motif: GCNGGAAGYG; match class: 1	19917	6251	1.12260234873987
query_1	TRUE	2.60312711127612e-06	2758	535	126	0.235514018691589	0.0456852791878173	TF:M09739_1	TF	Factor: ZGPAT; motif: GRGGCWGNGGNG; match class: 1	19917	8901	1.70077328146496
query_1	TRUE	2.66256805606483e-06	1386	3770	351	0.0931034482758621	0.253246753246753	TF:M09967_1	TF	Factor: AP-2rep; motif: NGGGGCGGGGC; match class: 1	19917	147	1.33790864308106
query_1	TRUE	2.75742530937265e-06	3985	2521	621	0.246330821102737	0.155834378920954	TF:M10008_1	TF	Factor: CSX; motif: NKRAGWGS; match class: 1	19917	5545	1.23115958943619
query_1	TRUE	2.78360732592791e-06	13330	3931	2790	0.709743067921648	0.209302325581395	TF:M00144	TF	Factor: Pax-5; motif: RRMSWGANWYCTNRAGCGKRACSRYNSM	19917	6102	1.06046156667633
query_1	TRUE	2.94272465811564e-06	1026	3019	227	0.0751904604173567	0.221247563352826	TF:M08905_1	TF	Factor: TIEG1; motif: GGSGGKGNNN; match class: 1	19917	8391	1.45961832371588
query_1	TRUE	3.17865757141213e-06	96	3681	46	0.0124966041836457	0.479166666666667	GO:0006614	GO:BP	SRP-dependent cotranslational protein targeting to membrane	18123	2599	2.35912455854387
query_1	TRUE	3.19564826680558e-06	191	3243	65	0.0200431699044095	0.340314136125654	GO:0044391	GO:CC	ribosomal subunit	18964	2334	1.99004541396451
query_1	TRUE	3.22395411487596e-06	6233	3785	1341	0.354293262879789	0.21514519493021	TF:M11480	TF	Factor: AP-2alpha; motif: NGCCTSAGGCN	19917	8190	1.132112773428
query_1	TRUE	3.25897531207003e-06	6210	2512	916	0.364649681528662	0.147504025764895	TF:M04617	TF	Factor: LRF; motif: NGNAGNGGGTYN	19917	4604	1.1695213698883
query_1	TRUE	3.79983517216704e-06	3438	2219	487	0.219468228931951	0.141652123327516	TF:M01721_1	TF	Factor: PUR1; motif: GGGNCAGNN; match class: 1	19917	6733	1.2714219649906
query_1	TRUE	3.91871159345047e-06	4775	833	275	0.330132052821128	0.0575916230366492	TF:M09859	TF	Factor: NF90; motif: NCCNCWGCCYCCNC	19917	5324	1.3770136326782
query_1	TRUE	3.96601394122225e-06	6798	3923	1500	0.382360438439969	0.220653133274492	TF:M02065_1	TF	Factor: ER81; motif: RCCGGAARYN; match class: 1	19917	1861	1.12025196416724
query_1	TRUE	4.04821902873658e-06	10214	1336	791	0.592065868263473	0.0774427256706481	TF:M01835_1	TF	Factor: GKLF; motif: CCTCCYN; match class: 1	19917	3031	1.15451105328016
query_1	TRUE	4.17260436799042e-06	2200	2005	305	0.15211970074813	0.138636363636364	TF:M07141	TF	Factor: FPM315; motif: GGAGGAGGRRGRGGRGGRRGR	19917	9320	1.37716730900023
query_1	TRUE	4.195272259055e-06	2672	3870	636	0.164341085271318	0.238023952095808	TF:M00940_1	TF	Factor: E2F-1; motif: NTTTCGCGCS; match class: 1	19917	1393	1.22499303718145
query_1	TRUE	4.43426759833776e-06	1744	3866	436	0.112778065183652	0.25	TF:M08875_1	TF	Factor: E2F; motif: NNTTTCGCGCN; match class: 1	19917	1489	1.28795913088464
query_1	TRUE	4.656060955732e-06	2298	703	135	0.19203413940256	0.0587467362924282	TF:M12185	TF	Factor: BTEB4; motif: RCCACGCCCC	19917	4368	1.66437944059217
query_1	TRUE	5.3040678355523e-06	5634	3930	1264	0.321628498727735	0.224352147674831	TF:M00918	TF	Factor: E2F; motif: TTTSGCGSG	19917	1480	1.13700298352153
query_1	TRUE	6.90967826440904e-06	5407	3922	1214	0.309535951045385	0.224523765489181	TF:M00425_1	TF	Factor: E2F; motif: TTTCGCGC; match class: 1	19917	1479	1.14019373718715
query_1	TRUE	7.50542638749195e-06	10355	3923	2205	0.562069844506755	0.212940608401738	TF:M00025	TF	Factor: Elk-1; motif: NNNNCCGGAARTNN	19917	1744	1.08109561497258
query_1	TRUE	7.75682131540831e-06	9427	1690	916	0.542011834319527	0.0971677097698101	TF:M10550_1	TF	Factor: ZNF684; motif: MAAGGGGTGGACTGT; match class: 1	19917	10479	1.1451415831274
query_1	TRUE	8.15825400430405e-06	44	14	4	0.285714285714286	0.0909090909090909	GO:0005891	GO:CC	voltage-gated calcium channel complex	18964	520	123.142857142857
query_1	TRUE	8.90428946733121e-06	111	3681	50	0.0135832654170062	0.45045045045045	GO:0045047	GO:BP	protein targeting to ER	18123	13134	2.21774341578743
query_1	TRUE	8.92334748417122e-06	11904	2318	1515	0.65358067299396	0.12726814516129	TF:M11401_1	TF	Factor: Fli-1; motif: NACCGGATATCCGGTN; match class: 1	19917	2355	1.09352875201787
query_1	TRUE	9.09273375255638e-06	2616	1005	197	0.196019900497512	0.0753058103975535	TF:M04932	TF	Factor: Sp2; motif: AAGGGGCGG	19917	7518	1.4924038066548
query_1	TRUE	1.03361186037318e-05	2165	1990	303	0.152261306532663	0.139953810623557	GO:0098588	GO:CC	bounding membrane of organelle	18964	3582	1.33371058525886
query_1	TRUE	1.04683044431212e-05	144	3681	60	0.0162999185004075	0.416666666666667	GO:0070972	GO:BP	protein localization to endoplasmic reticulum	18123	19228	2.05141265960337
query_1	TRUE	1.08057583941093e-05	2203	1926	293	0.152128764278297	0.133000453926464	TF:M12154	TF	Factor: Sp3; motif: NGCCACGCCCMCN	19917	7542	1.37537385298722
query_1	TRUE	1.09474666798761e-05	8113	3919	1758	0.448583822403674	0.216689264143966	TF:M00430	TF	Factor: E2F-1; motif: NTTSGCGG	19917	1384	1.1012503378299
query_1	TRUE	1.14855786687482e-05	4453	3856	1034	0.268153526970954	0.232203009207276	GO:0031981	GO:CC	nuclear lumen	18964	1452	1.14198596125695
query_1	TRUE	1.21438604890146e-05	4112	3856	961	0.249221991701245	0.233706225680934	GO:0005654	GO:CC	nucleoplasm	18964	312	1.14937885472335
query_1	TRUE	1.24398125315548e-05	12056	2318	1531	0.660483175150992	0.126990710019907	TF:M11401	TF	Factor: Fli-1; motif: NACCGGATATCCGGTN	19917	2354	1.09114494023576
query_1	TRUE	1.27521173551201e-05	1336	3420	310	0.0906432748538012	0.232035928143713	TF:M09893_1	TF	Factor: E2F-3; motif: NNGGCGGGAAA; match class: 1	19917	1423	1.35130397100536
query_1	TRUE	1.35287695188633e-05	1547	1444	173	0.119806094182825	0.111829347123465	TF:M08819_1	TF	Factor: LKLF; motif: CNCCACCCS; match class: 1	19917	4575	1.5424550600125
query_1	TRUE	1.46479695611556e-05	11490	1001	665	0.664335664335664	0.0578764142732811	TF:M00143	TF	Factor: Pax-5; motif: BCNNNRNGCANBGNTGNRTAGCSGCHNB	19917	6100	1.15157297011083
query_1	TRUE	1.49330543563515e-05	1426	3866	363	0.0938954992240041	0.254558204768583	TF:M12159	TF	Factor: KLF15; motif: GCCACGCCCMCN	19917	4360	1.31144225669319
query_1	TRUE	1.50089341304165e-05	14850	2521	1996	0.791749305831019	0.134410774410774	TF:M00378_1	TF	Factor: Pax-4; motif: NNNNNYCACCCB; match class: 1	19917	6075	1.06190376594185
query_1	TRUE	1.68322718342196e-05	13587	3919	2823	0.720336820617504	0.207772135129168	TF:M11883	TF	Factor: pax-6; motif: NYACGCNTSRNYGCNYN	19917	6130	1.05593202739669
query_1	TRUE	1.69972089588581e-05	1479	3874	375	0.096799173980382	0.253549695740365	TF:M00237_1	TF	Factor: AhR:Arnt; motif: GRGKATYGCGTGMCWNSCC; match class: 1	19917	11	1.30354911978855
query_1	TRUE	1.71954277175482e-05	46	14	4	0.285714285714286	0.0869565217391304	GO:0005245	GO:MF	voltage-gated calcium channel activity	18679	1731	116.018633540373
query_1	TRUE	1.78780779534498e-05	6037	3898	1331	0.341457157516675	0.220473745237701	TF:M11490_1	TF	Factor: LBP-1; motif: NRCCGGTNNNNACCGGYN; match class: 1	19917	4423	1.12652016005626
query_1	TRUE	1.84942202178211e-05	1348	259	44	0.16988416988417	0.0326409495548961	GO:0045202	GO:CC	synapse	18964	2447	2.38997284694614
query_1	TRUE	1.85768082422156e-05	2313	3208	471	0.146820448877805	0.203631647211414	TF:M00665_1	TF	Factor: Sp3; motif: ASMCTTGGGSRGGG; match class: 1	19917	7545	1.26425546057036
query_1	TRUE	1.91742934232209e-05	7795	3123	1367	0.43772014089017	0.175368826170622	TF:M00665	TF	Factor: Sp3; motif: ASMCTTGGGSRGGG	19917	7544	1.11841847929564
query_1	TRUE	1.94770714043426e-05	1004	3033	220	0.0725354434553248	0.219123505976096	TF:M12156_1	TF	Factor: Sp2; motif: NTAAGYCCCGCCCMCTN; match class: 1	19917	7533	1.43893269651365
query_1	TRUE	1.97485560650207e-05	5266	2520	787	0.312301587301587	0.149449297379415	TF:M07387	TF	Factor: LRF; motif: NGKGGGTSNCN	19917	4602	1.18118319678802
query_1	TRUE	2.00508569488567e-05	194	1901	45	0.0236717517096265	0.231958762886598	GO:0030136	GO:CC	clathrin-coated vesicle	18964	1076	2.31397473928535
query_1	TRUE	2.30876361599661e-05	12	14	3	0.214285714285714	0.25	GO:1990454	GO:CC	L-type voltage-gated calcium channel complex	18964	4287	338.642857142857
query_1	TRUE	2.35978230222509e-05	5748	1011	374	0.369930761622156	0.0650661099512874	TF:M00706	TF	Factor: TFII-I; motif: RGAGGKAGG	19917	8316	1.28182167349139
query_1	TRUE	2.38012573490334e-05	4050	3869	917	0.23701214784182	0.22641975308642	TF:M00738_1	TF	Factor: E2F-4:DP-1; motif: TTTSGCGC; match class: 1	19917	1431	1.16557307371988
query_1	TRUE	2.49170552858672e-05	1431	1932	204	0.105590062111801	0.142557651991614	TF:M01231	TF	Factor: ZNF515; motif: GTGGGGGGTM	19917	9954	1.46962771983281
query_1	TRUE	2.49526821223351e-05	17131	3931	3490	0.88781480539303	0.203724242601132	TF:M11018	TF	Factor: IRX-1; motif: NACRYNNNNNNNNRYGNN	19917	4194	1.03219937417623
query_1	TRUE	2.52056727710681e-05	17225	2512	2261	0.900079617834395	0.131262699564586	TF:M08207	TF	Factor: E2F-3:TBR2; motif: ANGTGYKANGGCGCSTTNNCRNNT	19917	1410	1.04074808408753
query_1	TRUE	2.5232757675418e-05	143	14	5	0.357142857142857	0.034965034965035	GO:0022843	GO:MF	voltage-gated cation channel activity	18679	4677	46.6508491508492
query_1	TRUE	2.57330210349905e-05	2141	3929	524	0.133367269025197	0.244745446053246	TF:M07052	TF	Factor: NRF-1; motif: GCGCMTGCGCN	19917	5776	1.24067066659265
query_1	TRUE	2.67620929308019e-05	4841	3856	1075	0.278786307053942	0.222061557529436	TF:M08529_1	TF	Factor: E2F-3:T-bet; motif: AGGTGTNANGGCGCST; match class: 1	19917	1419	1.14699171195897
query_1	TRUE	2.75901880883197e-05	2740	3714	621	0.167205169628433	0.226642335766423	TF:M03932	TF	Factor: ZIC4; motif: GRCCCCCCGCNGNGN	19917	8922	1.21541071660201
query_1	TRUE	2.77746136582461e-05	7003	2489	1003	0.402973081558859	0.143224332428959	TF:M11477_1	TF	Factor: AP-2beta; motif: NSCCYNRGGSN; match class: 1	19917	8199	1.14608237404081
query_1	TRUE	3.0093708258878e-05	1400	989	118	0.119312436804853	0.0842857142857143	TF:M10172	TF	Factor: HKR2; motif: NGNCNGAGGGMGGAGG	19917	3294	1.69738985988733
query_1	TRUE	3.16369272811476e-05	3899	3769	864	0.229238524807641	0.221595280841241	TF:M04109_1	TF	Factor: RUNX3; motif: NRACCGCAAACCGCAN; match class: 1	19917	7045	1.17100376983683
query_1	TRUE	3.23439366245422e-05	3253	3887	754	0.193979933110368	0.231786043652014	TF:M09641	TF	Factor: NRF-1; motif: SYGCGCMTGCGCRNNGSN	19917	5772	1.18767240324599
query_1	TRUE	3.24380301327002e-05	1478	2638	270	0.10235026535254	0.182679296346414	TF:M01972_1	TF	Factor: EGR-1; motif: TGCGTGGGCGK; match class: 1	19917	1527	1.37923561233189
query_1	TRUE	3.25363172594777e-05	11838	3923	2487	0.633953606933469	0.210086163203244	TF:M11435	TF	Factor: Elk-1; motif: NNCCGGAAGTN	19917	1764	1.06660364836069
query_1	TRUE	3.3018933308386e-05	1686	258	51	0.197674418604651	0.0302491103202847	TF:M07367	TF	Factor: Slug; motif: SSSNNNKCACCTGN	19917	7232	2.33516096995779
query_1	TRUE	3.43838472207793e-05	4638	3853	1032	0.267843239034519	0.222509702457956	TF:M00740_1	TF	Factor: Rb:E2F-1:DP-1; motif: TTTSGCGC; match class: 1	19917	1359	1.15020133502598
query_1	TRUE	3.56727672584071e-05	6128	3838	1327	0.345752996352267	0.216546997389034	TF:M09893	TF	Factor: E2F-3; motif: NNGGCGGGAAA	19917	1422	1.12375365997848
query_1	TRUE	3.60589197132168e-05	200	21	6	0.285714285714286	0.03	GO:0005244	GO:MF	voltage-gated ion channel activity	18679	1730	26.6842857142857
query_1	TRUE	3.71426720519516e-05	201	21	6	0.285714285714286	0.0298507462686567	GO:0022832	GO:MF	voltage-gated channel activity	18679	4669	26.5515280739161
query_1	TRUE	3.79885513098422e-05	115	3681	50	0.0135832654170062	0.434782608695652	GO:0072599	GO:BP	establishment of protein localization to endoplasmic reticulum	18123	20412	2.14060451436873
query_1	TRUE	3.82846859674039e-05	8310	3201	1480	0.462355513901906	0.178098676293622	TF:M11477	TF	Factor: AP-2beta; motif: NSCCYNRGGSN	19917	8198	1.10815099523276
query_1	TRUE	3.95288439813448e-05	1205	3858	311	0.0806117159149819	0.258091286307054	TF:M08440	TF	Factor: AP-2gamma:E2F-8; motif: NTTCCCGCNNSCCCSMGGC	19917	8206	1.33240128288688
query_1	TRUE	4.06020775571732e-05	1706	1708	212	0.124121779859485	0.124267291910903	TF:M00084_1	TF	Factor: MZF-1; motif: KNGNKAGGGGNAA; match class: 1	19917	5223	1.44908176404534
query_1	TRUE	4.14711474311723e-05	5115	3876	1134	0.292569659442724	0.221700879765396	TF:M00143_1	TF	Factor: Pax-5; motif: BCNNNRNGCANBGNTGNRTAGCSGCHNB; match class: 1	19917	6101	1.13921992319076
query_1	TRUE	4.2294284911214e-05	227	21	6	0.285714285714286	0.026431718061674	GO:0034703	GO:CC	cation channel complex	18964	1771	23.8691000629327
query_1	TRUE	4.40999700345576e-05	7762	3849	1653	0.4294621979735	0.212960577170832	TF:M08767_1	TF	Factor: HES-1; motif: GNCACGTGNC; match class: 1	19917	3191	1.10198384398843
query_1	TRUE	4.43071422162126e-05	2886	2250	417	0.185333333333333	0.144490644490644	TF:M00446_1	TF	Factor: Spz1; motif: DNNGGRGGGWWNNNN; match class: 1	19917	7631	1.27903118503118
query_1	TRUE	4.76777206522962e-05	7868	3926	1705	0.43428425878757	0.21670055922725	TF:M08767	TF	Factor: HES-1; motif: GNCACGTGNC	19917	3190	1.09934412586071
query_1	TRUE	4.82193566997602e-05	566	1730	90	0.0520231213872832	0.159010600706714	TF:M01122	TF	Factor: ZNF219; motif: CRCCCCCCNCCC	19917	9174	1.8306440082518
query_1	TRUE	5.17642473697148e-05	7682	312	169	0.541666666666667	0.021999479302265	TF:M09746_1	TF	Factor: HNRPUL1; motif: NCNCAGN; match class: 1	19917	3475	1.40437060661286
query_1	TRUE	5.77300227533854e-05	71	14	4	0.285714285714286	0.0563380281690141	GO:0034704	GO:CC	calcium channel complex	18964	1772	76.3138832997988
query_1	TRUE	5.78625650295177e-05	2368	2423	374	0.154354106479571	0.157939189189189	TF:M12150	TF	Factor: SP9; motif: NCCACGCCCMCN	19917	7576	1.29825622413582
query_1	TRUE	5.87716404336339e-05	55	2118	21	0.00991501416430595	0.381818181818182	GO:0030120	GO:CC	vesicle coat	18964	1060	3.41869688385269
query_1	TRUE	5.96737570805334e-05	1420	3929	363	0.0923899210995164	0.255633802816901	TF:M03834	TF	Factor: N-Myc; motif: GSSCACGYGS	19917	5632	1.29586623840779
query_1	TRUE	6.03261412716382e-05	2484	3560	591	0.166011235955056	0.23792270531401	GO:0007399	GO:BP	nervous system development	18123	3289	1.21120033382185
query_1	TRUE	6.07135950763189e-05	2391	2490	386	0.155020080321285	0.161438728565454	TF:M12149	TF	Factor: SP9; motif: RCCACGCCCMCY	19917	7574	1.29131532403138
query_1	TRUE	6.46936260046999e-05	789	1935	126	0.0651162790697674	0.159695817490494	GO:0030659	GO:CC	cytoplasmic vesicle membrane	18964	1118	1.56510154154508
query_1	TRUE	6.93527226362692e-05	5889	3785	1260	0.332892998678996	0.21395822720326	TF:M11480_1	TF	Factor: AP-2alpha; motif: NGCCTSAGGCN; match class: 1	19917	8191	1.12586684576152
query_1	TRUE	7.1357466798789e-05	5633	3861	1232	0.319088319088319	0.218711166341204	TF:M08457_1	TF	Factor: ER71:SREBP-2; motif: NTSACGTGACGGAARY; match class: 1	19917	2149	1.12822333592793
query_1	TRUE	7.33840229498696e-05	1384	221	39	0.176470588235294	0.0281791907514451	GO:0043005	GO:CC	neuron projection	18964	2094	2.418055083305
query_1	TRUE	7.34375463206385e-05	697	2492	138	0.0553772070626003	0.197991391678623	TF:M10139	TF	Factor: ZNF320; motif: GKGGGNCCMGGGGGCCWRTG	19917	9478	1.58242156824363
query_1	TRUE	7.9214406550824e-05	12624	3822	2569	0.672161172161172	0.203501267427123	TF:M09817	TF	Factor: PAX5; motif: RNGCGTGACCNN	19917	6114	1.06047481510885
query_1	TRUE	8.55396063128261e-05	121	1153	25	0.0216825672159584	0.206611570247934	TF:M01231_1	TF	Factor: ZNF515; motif: GTGGGGGGTM; match class: 1	19917	9955	3.5690222416549
query_1	TRUE	9.1696614749361e-05	1995	3785	485	0.128137384412153	0.243107769423559	GO:0005783	GO:CC	endoplasmic reticulum	18964	427	1.21804378846721
query_1	TRUE	9.81741512335502e-05	4143	656	195	0.297256097560976	0.0470673425054308	TF:M08993_1	TF	Factor: ZNF777; motif: GTCCGYCCCGTCSAACAAT; match class: 1	19917	10781	1.42902478762297
query_1	TRUE	9.9932413521418e-05	556	3559	155	0.0435515594268053	0.278776978417266	GO:0008134	GO:MF	transcription factor binding	18679	1992	1.46312873836924
query_1	TRUE	0.000101208111175326	2894	1401	276	0.197002141327623	0.0953697304768487	TF:M09890_1	TF	Factor: ctcf; motif: YGGCCACCAGRKGGCRSYN; match class: 1	19917	1095	1.35580222834218
query_1	TRUE	0.000106672674557593	7811	3453	1497	0.433536055603823	0.191652797337089	TF:M08952	TF	Factor: NF-KAPPAB1; motif: NGGKRNTTYCCCN	19917	5452	1.10545866335442
query_1	TRUE	0.000107410643403074	1021	1888	150	0.0794491525423729	0.146914789422135	TF:M01597	TF	Factor: Zfp281; motif: TGGGGGAGGGG	19917	8830	1.54984208735205
query_1	TRUE	0.000116039908326229	725	3518	188	0.053439454235361	0.259310344827586	GO:0000139	GO:CC	Golgi membrane	18964	20	1.39782870361295
query_1	TRUE	0.000117183813146309	1055	612	70	0.11437908496732	0.0663507109004739	GO:0009790	GO:BP	embryo development	18123	4145	1.96482668896943
query_1	TRUE	0.000121985421121016	10782	690	443	0.642028985507246	0.0410869968465962	TF:M09729	TF	Factor: LUMAN; motif: CYCAGCYYCY	19917	4628	1.18598509593283
query_1	TRUE	0.000123878597810862	1030	2836	209	0.0736953455571227	0.202912621359223	TF:M01253_1	TF	Factor: CNOT3; motif: GGCCGCGSSS; match class: 1	19917	869	1.42503902666137
query_1	TRUE	0.000124152672275812	13992	839	658	0.784266984505363	0.0470268724985706	TF:M10491	TF	Factor: ZNF586; motif: CAGGCCYRGAGG	19917	10214	1.11636974917048
query_1	TRUE	0.00013603039292467	12666	3923	2640	0.672954371654346	0.208432022738039	TF:M02065	TF	Factor: ER81; motif: RCCGGAARYN	19917	1860	1.05820560715614
query_1	TRUE	0.000149715038621592	641	389	34	0.0874035989717224	0.0530421216848674	GO:0098794	GO:CC	postsynapse	18964	3626	2.58583752090443
query_1	TRUE	0.000149857429938816	13785	2334	1727	0.739931448157669	0.125281102647806	TF:M11393_1	TF	Factor: Erg; motif: NACCGGATATCCGGTN; match class: 1	19917	1945	1.06907614457427
query_1	TRUE	0.000150109766843251	706	3597	190	0.052821795941062	0.269121813031161	GO:0019904	GO:MF	protein domain specific binding	18679	4623	1.39753304020269
query_1	TRUE	0.000151644354939821	4513	2521	679	0.269337564458548	0.150454243297142	TF:M00257_1	TF	Factor: RREB-1; motif: CCCCAAACMMCCCC; match class: 1	19917	7015	1.18865417046774
query_1	TRUE	0.000152011311130715	7130	3912	1546	0.39519427402863	0.216830294530154	TF:M00050	TF	Factor: E2F; motif: TTTSGCGC	19917	1472	1.10393889983565
query_1	TRUE	0.000155488990413651	3878	3922	885	0.225650178480367	0.228210417741104	TF:M00427_1	TF	Factor: E2F; motif: TTTSGCGS; match class: 1	19917	1491	1.15891557627475
query_1	TRUE	0.000158769846313567	5682	3914	1254	0.320388349514563	0.220696937697994	TF:M00739	TF	Factor: E2F-4:DP-2; motif: TTTCSCGC	19917	1432	1.12305081965532
query_1	TRUE	0.00016132150174311	12179	3498	2279	0.651515151515151	0.187125379752032	TF:M03978	TF	Factor: ETS1; motif: GCCGGAWGTACTTCCGGN	19917	2074	1.06545917339086
query_1	TRUE	0.000166009883511496	4876	3929	1093	0.278187834054467	0.224159146841674	TF:M02070_1	TF	Factor: TEL1; motif: CNCGGAANNN; match class: 1	19917	8173	1.13631400550919
query_1	TRUE	0.000170784169688224	371	326	22	0.0674846625766871	0.0592991913746631	GO:0098984	GO:CC	neuron to neuron synapse	18964	3704	3.44953946389298
query_1	TRUE	0.000179578259205156	3919	1401	355	0.253390435403283	0.0905843327379433	TF:M09828	TF	Factor: CTCF; motif: RSYGCCMYCTRSTGGN	19917	1092	1.28777170245654
query_1	TRUE	0.000183648587533666	4809	3930	1079	0.274554707379135	0.224370971095862	TF:M11528_1	TF	Factor: E2F-2; motif: NTTTTGGCGCCAWWWN; match class: 1	19917	1401	1.13709837946979
query_1	TRUE	0.00018740062336086	13307	3915	2756	0.703959131545338	0.207109040354701	TF:M11881	TF	Factor: pax-6; motif: NYACGCNTSANYGCNYN	19917	6126	1.05363748575851
query_1	TRUE	0.000188405484989619	11156	2512	1531	0.609474522292994	0.137235568304052	TF:M11081	TF	Factor: SREBP-1; motif: RTCRCGTGAY	19917	7638	1.08810541955087
query_1	TRUE	0.000208104803873217	1022	3873	267	0.0689388071262587	0.261252446183953	TF:M01273_1	TF	Factor: SP4; motif: SCCCCGCCCCS; match class: 1	19917	7557	1.34349728134412
